avg_rating,extracted_at,geek_rating,id,num_voters,rank,short_description,title,type,year_published
7.23,1660708124.9633,6.388,2122,2340.0,1326,Manipulate your vampire minions to destroy your prey while fending off your predator.,Vampire: The Eternal Struggle,boardgame,1994
6.57,1660708124.9633,6.386,19237,9984.0,1327,Do you have the nerves for a Mexican standoff? Walk away rich or end up on the floor.,Ca$h 'n Gun$,boardgame,2005
6.62,1660708124.9633,6.386,176229,7153.0,1328,Erect new monuments and use relics from the past to create the greatest civilization!,Tides of Time,boardgame,2015
7.22,1660708124.9633,6.386,75165,1935.0,1329,"Travel around Italy, and do your parts to create the Volgare, the new language!",De Vulgari Eloquentia,boardgame,2010
7.74,1660708124.9633,6.385,291845,1212.0,1330,"Manage your backyard garden of corn, beans, and pumpkins.",Three Sisters,boardgame,2022
7.03,1660708124.9633,6.385,66,2495.0,1331,Knights increase your landholdings as you try to have the largest kingdom.,Löwenherz,boardgame,1997
6.83,1660708124.9633,6.385,129051,3535.0,1332,Manipulate resources and purchase buildings to become the richest harbor master.,Le Havre: The Inland Port,boardgame,2012
7.66,1660708124.9633,6.385,151771,1364.0,1333,"Mafiosos compete to turn the greatest profit, but watch out for rival gangs!",La Cosa Nostra,boardgame,2014
6.81,1660708124.9633,6.383,1231,3968.0,1334,It’s all about beans & building in this last-one-standing dexterity game.,Bausack,boardgame,1987
6.87,1660708124.9633,6.382,902,3284.0,1335,"Sail to isles & sell your goods, but the captain says where. You should be captain.",Meuterer,boardgame,2000
6.76,1660708124.9633,6.382,16496,4593.0,1336,In this Roman struggle use the powers of the cards you build only if the dice allow.,Roma,boardgame,2005
6.57,1660708124.9633,6.382,15818,9903.0,1337,"Roll those bones, push your luck and secure your stash of worms!",Pickomino,boardgame,2005
8.36,1660708124.9633,6.381,277659,900.0,1338,You alone must survive and defeat the horror movie killer.,Final Girl,boardgame,2021
7.47,1660708124.9633,6.381,227456,2863.0,1339,"After years of wrongful incarceration, you embark on a desperate quest to escape...",Escape the Dark Castle,boardgame,2017
7.38,1660708124.9633,6.381,300753,1821.0,1340,Race against time to fill the grid by cluing intersecting words.,Cross Clues,boardgame,2020
6.66,1660708124.9633,6.381,624,7206.0,1341,Either move your pawn or place a wall to cross the board first.,Quoridor,boardgame,1997
7.51,1660708124.9633,6.38,55829,1780.0,1342,"Focus on the war in the Pacific with plastic troops, tanks, planes, and ships.",Axis & Allies Pacific 1940,boardgame,2009
7.63,1660708124.9633,6.379,225244,1387.0,1343,,Ticket to Ride: Germany,boardgame,2017
7.25,1660708124.9633,6.379,169794,1849.0,1344,"Find coal, build and operate your mine for the most profit.",Haspelknecht: The Story of Early Coal Mining,boardgame,2015
6.71,1660708124.9633,6.378,181810,5467.0,1345,Build trees out of cards to make your forest spirit friends happy!,Kodama: The Tree Spirits,boardgame,2016
7.05,1660708124.9633,6.378,120523,2337.0,1346,Blackmail. Bribery. Crime. Negotiations abound-but only one can be the next mob boss.,Nothing Personal,boardgame,2013
6.89,1660708124.9633,6.378,191894,3504.0,1347,Overlay & animate transparent cards in this creative party game.,Imagine,boardgame,2015
7.73,1660708124.9633,6.377,281946,1330.0,1348,"Scavenge, explore and fight to defend your colony in the world humans left behind.",Aftermath,boardgame,2019
7.63,1660708124.9633,6.376,342848,1442.0,1349,Survive against hordes of undead on Azeroth to face off against the Lich King.,World of Warcraft: Wrath of the Lich King,boardgame,2021
6.79,1660708124.9633,6.376,6411,3936.0,1350,Construct 3-D structures with your opponents while also trying out outwit them.,Blokus 3D,boardgame,2003
6.9,1660708124.9633,6.375,492,3163.0,1351,Bluff and bid your way to fabulous fortunes.,Aladdin's Dragons,boardgame,2000
6.96,1660708124.9633,6.375,196,2875.0,1352,Control the USSR politbureau as dying men step into dead men's shoes.,Kremlin,boardgame,1986
6.65,1660708124.9633,6.375,71836,6199.0,1353,"Shuffle through your dreams, opening doors, and avoiding nightmares.",Onirim,boardgame,2010
7.47,1660708124.9633,6.374,166857,1440.0,1354,Historical empires develop and confront each other to dominate the ancient world.,Antike II,boardgame,2014
7.36,1660708124.9633,6.374,316858,1640.0,1355,"Travel in airships above dried-up landscapes, visit cities, and battle Cloud militia.",CloudAge,boardgame,2020
7.6,1660708124.9633,6.373,109125,1281.0,1356,,Wallenstein (Second Edition),boardgame,2012
7.78,1660708124.9633,6.373,271529,1160.0,1357,Build the best steampunk garden by winning the tiles you need.,Botanik,boardgame,2021
6.83,1660708124.9633,6.372,101785,3542.0,1358,An elite group of Army Rangers is ordered to take out German machine gun nests.,D-Day Dice,boardgame,2012
7.4,1660708124.9633,6.372,283294,1581.0,1359,Deliver passengers while managing your fuel and making improvements to your seaplane.,Yukon Airways,boardgame,2019
6.83,1660708124.9633,6.372,481,3528.0,1360,Control mercenaries to control lands. Then merge the lands to control France.,Carolus Magnus,boardgame,2000
7.31,1660708124.9633,6.371,298371,1686.0,1361,Explore a new galaxy full of treasures and mysteries using card combos!,Wild Space,boardgame,2020
6.82,1660708124.9633,6.371,165950,3706.0,1362,Animals line up to get into the Beasty Bar but only some will join the party.,Beasty Bar,boardgame,2014
7.02,1660708124.9633,6.37,216201,2741.0,1363,Program your robot to race around a hazardous factory.,Robo Rally,boardgame,2016
7.4,1660708124.9633,6.369,172220,1891.0,1364,Explore the monster-infested dungeons beneath the Sword Coast.,Dungeons & Dragons: Temple of Elemental Evil Board Game,boardgame,2015
7.85,1660708124.9633,6.369,22877,1220.0,1365,"Solitaire wargame of commanding a rifle company in Normandy, Korea and Vietnam.",Fields of Fire,boardgame,2008
7.61,1660708124.9633,6.368,146910,1257.0,1366,"Use wildcatters to discover, produce and sell raw oil in 19th century.",Wildcatters,boardgame,2013
8.04,1660708124.9633,6.368,20542,1054.0,1367,Learn ASL with easier rules adding Tanks to the previous starter kits.,Advanced Squad Leader: Starter Kit #3,boardgame,2007
6.8,1660708124.9633,6.368,195544,3775.0,1368,Draft Cards that work together to gain points....but don't lose your sanity first!,Tides of Madness,boardgame,2016
7.05,1660708124.9633,6.368,271088,2456.0,1369,"Grow wondrous gardens in a desert filled with gems, but room is sparse!",Ishtar: Gardens of Babylon,boardgame,2019
6.51,1660708124.9633,6.367,438,15594.0,1370,"Mr. X is on the run in London, will the detectives find him in time?",Scotland Yard,boardgame,1983
6.81,1660708124.9633,6.367,24417,3454.0,1371,Place machines and connect them with pipes to create the most efficient factory.,Factory Fun,boardgame,2006
7.79,1660708124.9633,6.366,283317,1158.0,1372,Journey through a vibrant but deadly land to uncover the key to lifting your curse.,The 7th Continent: Classic Edition,boardgame,2019
7.45,1660708124.9633,6.366,272682,1444.0,1373,Continue the Oh My Goods! saga - utilizing production chains on the Great Expedition.,Expedition to Newdale,boardgame,2019
7.44,1660708124.9633,6.365,271319,1477.0,1374,"Las Vegas gets a make over, adding some new incentives to the classic dice game.",Las Vegas Royale,boardgame,2019
7.45,1660708124.9633,6.365,205317,1839.0,1375,Rip & tear your way through Hell's legions in this adaptation of the 2016 video game.,DOOM: The Board Game,boardgame,2016
6.55,1660708124.9633,6.364,2397,12747.0,1376,"Quickly roll & move your pieces off the board, but don't leave lone ones defenseless!",Backgammon,boardgame,-3000
7.8,1660708124.9633,6.364,268201,1233.0,1377,,Dice Throne,boardgame,2018
7.3,1660708124.9633,6.364,3072,1863.0,1378,,Necromunda,boardgame,1995
7.41,1660708124.9633,6.364,166571,1443.0,1379,Ensure your citizens' happiness by delivering them swiftly across your rail network.,Tramways,boardgame,2016
6.78,1660708124.9633,6.364,131325,4053.0,1380,,Timeline: General Interest,boardgame,2012
6.96,1660708124.9633,6.364,43022,2924.0,1381,,Yomi,boardgame,2011
8.18,1660708124.9633,6.363,302098,1080.0,1382,,Chronicles of Crime: 1900,boardgame,2021
7.1,1660708124.9633,6.362,312267,2074.0,1383,"Escape situations on Hoth, Jedha & an Imperial ship in a galaxy far, far away.",Star Wars: Unlock!,boardgame,2020
6.91,1660708124.9633,6.362,594,2855.0,1384,Question and observe. It's up to you to find the missing gem.,Sleuth,boardgame,1971
7.31,1660708124.9633,6.361,1915,1935.0,1385,"Build your deck, reunite the Free Peoples and stop your opponent!",Middle-earth,boardgame,1995
6.82,1660708124.9633,6.361,24827,3355.0,1386,Manage the market & bring goods to trade in Osaka or be forced to fend off pirates.,Traders of Osaka,boardgame,2006
7.07,1660708124.9633,6.361,304285,2252.0,1387,"A one-versus-many rendition of Love Letter, with Thanos taking on the Avengers.",Infinity Gauntlet: A Love Letter Game,boardgame,2020
6.92,1660708124.9633,6.36,223740,3134.0,1388,Sell heroes the gear they need to defeat monsters threatening your town.,Bargain Quest,boardgame,2017
7.28,1660708124.9633,6.36,254713,1767.0,1389,Build a base on Europa by fighting for limited resources & avoiding lethal exposure.,The Artemis Project,boardgame,2019
6.91,1660708124.9633,6.36,204,2770.0,1390,It's the dawn of steam and pioneering rail companies compete and ultimately merge.,Stephenson's Rocket,boardgame,1999
7.05,1660708124.9633,6.36,18745,2300.0,1391,Will your dynasty be the one to finally bring unity to China?,Sun Tzu,boardgame,2005
7.56,1660708124.9633,6.359,272380,1341.0,1392,Use your stones to push all your opponent's stones off any one of four boards to win!,SHŌBU,boardgame,2019
6.75,1660708124.9633,6.359,244995,3972.0,1393,Put your color perception to the test and call the group's bluff at the right moment.,Illusion,boardgame,2018
7.34,1660708124.9633,6.359,7480,1604.0,1394,Card-driven struggle to dominate the Western Med in the 3rd and 4th centuries BC.,Sword of Rome,boardgame,2004
6.89,1660708124.9633,6.359,21550,3069.0,1395,Fit all your tiles onto the board while blocking your neighbor into a corner.,Blokus Trigon,boardgame,2006
6.57,1660708124.9633,6.359,131366,8098.0,1396,Build an empire that eclipses your rivals in just 8 minutes!,Eight-Minute Empire,boardgame,2012
7.0,1660708124.9633,6.359,148943,2624.0,1397,,Coup: Rebellion G54,boardgame,2014
7.33,1660708124.9633,6.357,94104,1613.0,1398,Children of Zeus compete to win the favour of the gods and become the heir to Olympus,Omen: A Reign of War,boardgame,2011
6.72,1660708124.9633,6.357,194626,4626.0,1399,"High five, fist bump, switch places and have fun together. Be the fastest to win.",Happy Salmon,boardgame,2016
7.11,1660708124.9633,6.356,144041,2107.0,1400,"Patch your way through history! Use military, economy, politics and diplomacy wisely.",Patchistory,boardgame,2013
6.94,1660708124.9633,6.354,172381,2678.0,1401,Control your own village with the roll of the dice.,My Village,boardgame,2015
7.73,1660708124.9633,6.354,170604,1188.0,1402,A group of cyberpunk hackers team up to shut down a mind-controlling AI.,Renegade,boardgame,2018
6.81,1660708124.9633,6.354,201,3433.0,1403,Tense positional battle where seeing a few moves ahead is crucial.,The Rose King,boardgame,1992
7.38,1660708124.9633,6.353,47055,1539.0,1404,Space. The highest frontier.,High Frontier,boardgame,2010
7.38,1660708124.9633,6.353,255675,1506.0,1405,,Exit: The Game – The Catacombs of Horror,boardgame,2018
7.25,1660708124.9633,6.352,22,2059.0,1406,"The granddaddy of complex RPG-style board games, now available to print-and-play!",Magic Realm,boardgame,1979
7.96,1660708124.9633,6.351,219101,1035.0,1407,The Soviets defend a key strongpoint during the Battle of Stalingrad.,Pavlov's House,boardgame,2018
6.5,1660708124.9633,6.351,3955,28869.0,1408,Be the last one standing in this wild west shootout game with hidden roles.,BANG!,boardgame,2002
6.87,1660708124.9633,6.35,13780,2899.0,1409,Use your wealth and wits to nimbly deploy your nobles and win majorities.,In the Shadow of the Emperor,boardgame,2004
7.08,1660708124.9633,6.349,143175,2099.0,1410,Manage caravans to get goods to the market and sell them to the highest bidder.,Kashgar: Merchants of the Silk Road,boardgame,2013
7.03,1660708124.9633,6.349,1568,2880.0,1411,,Space Crusade,boardgame,1990
6.87,1660708124.9633,6.349,125548,3224.0,1412,"Tactical battle: 9 heroes vs. 9 heroes, each with 3 unique abilities.",Pixel Tactics,boardgame,2012
7.88,1660708124.9633,6.348,223931,1033.0,1413,"Help Holmes investigate more cases, including several in the Carlton House mansion.",Sherlock Holmes Consulting Detective: Carlton House & Queen's Park,boardgame,2017
6.79,1660708124.9633,6.348,106662,3490.0,1414,,Power Grid: The First Sparks,boardgame,2011
7.53,1660708124.9633,6.348,314088,1273.0,1415,Add farms to the card-laying experience of Sprawlopolis.,Agropolis,boardgame,2021
7.63,1660708124.9633,6.347,252752,1239.0,1416,Grab a trowel and breed pea plants on your way to become a master geneticist.,Genotype: A Mendelian Genetics Game,boardgame,2021
6.85,1660708124.9633,6.347,57925,3063.0,1417,"Rebuild Cuba's capital, Havana. Will you emerge as Cuba's greatest builder?",Havana,boardgame,2009
6.97,1660708124.9633,6.346,13884,2526.0,1418,Become the foremost wizard in the land through strategic shopping!,The Scepter of Zavandor,boardgame,2004
7.05,1660708124.9633,6.346,181524,2668.0,1419,"Dungeoneering heroes explore, discover and battle towards the final confrontation.",Masmorra: Dungeons of Arcadia,boardgame,2017
6.69,1660708124.9633,6.346,242,5574.0,1420,"Graft, betrayal, and the occasional coup attempt: just another day in the republic!",Junta,boardgame,1978
7.51,1660708124.9633,6.344,423,1289.0,1421,Fight to keep your Canadian railways afloat against a looming national railroad.,1856: Railroading in Upper Canada from 1856,boardgame,1995
6.85,1660708124.9633,6.344,268620,3151.0,1422,Use hints to find a secret card in a group of twelve.,Similo,boardgame,2019
7.33,1660708124.9633,6.343,297129,1602.0,1423,Will you maintain balance or give in to darkness in the battle of Hyde and Jekyll?,Jekyll vs. Hyde,boardgame,2021
7.12,1660708124.9633,6.343,156714,2258.0,1424,Players fight for influence and control in a demon-haunted Old West town.,Doomtown: Reloaded,boardgame,2014
7.22,1660708124.9633,6.342,332386,1891.0,1425,Bring balance back to the forest with potions and woodland creatures.,Brew,boardgame,2021
6.97,1660708124.9633,6.342,38862,2477.0,1426,,Giants,boardgame,2008
6.72,1660708124.9633,6.342,252929,4435.0,1427,Build biomes to create a unique 3D planet and attract the most wildlife.,Planet,boardgame,2018
6.78,1660708124.9633,6.342,115,3693.0,1428,"Negotiate your way into deals, but get too greedy and they'll cut you out!",I'm the Boss!,boardgame,1994
6.89,1660708124.9633,6.342,123570,2915.0,1429,"Throw dice in an arena, in order to be the last gladiator standing.",Strike,boardgame,2012
6.94,1660708124.9633,6.341,3228,2525.0,1430,You are a master builder! Cleverly disguise your coloured stones within your village.,Pueblo,boardgame,2002
7.34,1660708124.9633,6.341,122294,1595.0,1431,Stand united and gain honor with soul gems and trophies.,Ascension: Immortal Heroes,boardgame,2012
6.95,1660708124.9633,6.341,168,2932.0,1432,"Connect the north, east, south, and west in this pick-up-and-deliver train classic.",Empire Builder,boardgame,1982
7.41,1660708124.9633,6.34,267127,1446.0,1433,"Breezy game where you build giant, weird kites.",Aerion,boardgame,2019
7.15,1660708124.9633,6.34,152,1865.0,1434,Compendium of thought-provoking trick-taking games.,Mü & More,boardgame,1995
6.92,1660708124.9633,6.34,193308,2721.0,1435,Oust up to two spies with new locations and even more players!,Spyfall 2,boardgame,2016
6.76,1660708124.9633,6.339,176083,3995.0,1436,A dice chuckin' zombie filled run along Route 66.,Hit Z Road,boardgame,2016
6.92,1660708124.9633,6.339,92319,2639.0,1437,,Olympos,boardgame,2011
7.2,1660708124.9633,6.339,284108,1771.0,1438,Everyone uses vastly different items to get others to match their pieces to a photo!,Pictures,boardgame,2019
8.03,1660708124.9633,6.338,131111,1057.0,1439,Choose the right cards from your Codex of minions and spells to defeat your opponent!,Codex: Card-Time Strategy – Deluxe Set,boardgame,2016
7.33,1660708124.9633,6.338,171662,1618.0,1440,"Hunt fauna and learn culture as early humans, to survive the European Ice Age.",Neanderthal,boardgame,2015
7.19,1660708124.9633,6.338,226501,2331.0,1441,"Assemble your party, and begin the adventure along the famed Sword Coast.",Dragonfire,boardgame,2017
7.11,1660708124.9633,6.337,246200,1970.0,1442,Feathers fly in this battle over pecking order at the bird feeder.,Piepmatz,boardgame,2018
7.96,1660708124.9633,6.336,102435,964.0,1443,"Avoid being subjugated by either the Spanish, Mexicans or the Americans.",Navajo Wars,boardgame,2013
6.83,1660708124.9633,6.336,192860,3175.0,1444,Pilot your submarine and dive deep into the ocean collecting creatures and treasures.,Oceanos,boardgame,2016
6.6,1660708124.9633,6.336,143986,6195.0,1445,"Build a better life as you gain knowledge, a career and even find social happiness!",CV,boardgame,2013
8.58,1660708124.9633,6.336,349067,769.0,1446,Revised core set repackages the original with support for 1-4p and a new campaign.,The Lord of the Rings: The Card Game – Revised Core Set,boardgame,2022
7.51,1660708124.9633,6.335,241590,1329.0,1447,"1 question, 10 possible answers and players take turns to find the right ones.",Smart10,boardgame,2017
7.73,1660708124.9633,6.335,2081,1222.0,1448,"ACW strategic simulation with detailed leaders, supply chains, naval war, & more.",The Civil War 1861-1865,boardgame,1983
6.87,1660708124.9633,6.335,38343,2902.0,1449,"Spread your faction across the stars, exploring, exploiting, and settling.",Ad Astra,boardgame,2009
6.98,1660708124.9633,6.335,34194,2487.0,1450,Manage your water-themed zoo by making impressive exhibits maybe even baby animals!,Aquaretto,boardgame,2008
7.37,1660708124.9633,6.335,58936,1477.0,1451,Captures the intrigue and the skulduggery of the period brilliantly!,Wars of the Roses: Lancaster vs. York,boardgame,2010
8.01,1660708124.9633,6.334,40209,988.0,1452,Refight the Battle of Britain as either the RAF or the Luftwaffe or 1v1.,RAF: The Battle of Britain 1940,boardgame,2009
6.84,1660708124.9633,6.334,116954,3135.0,1453,Create tangled paths and move gemstones to your advantage.,Indigo,boardgame,2012
7.1,1660708124.9633,6.334,22484,1984.0,1454,Match double sided hexes and your lowest scored shape is your final score.,Ingenious: Travel Edition,boardgame,2006
7.35,1660708124.9633,6.334,232595,1571.0,1455,Stake your claim to the land as a clever fox tribe or a legendary Guardian!,Skulk Hollow,boardgame,2019
6.78,1660708124.9633,6.334,233678,3552.0,1456,"Be the first to fill your board with leaves of all shapes, aided by bonus powers.",Indian Summer,boardgame,2017
6.75,1660708124.9633,6.334,195043,3895.0,1457,Push your luck crawling through this dungeon. Did you remember the correct monsters?,Welcome Back to the Dungeon,boardgame,2016
7.68,1660708124.9633,6.333,297985,1137.0,1458,Marshal your forces across nine battlefields in a subtle and engaging card duel.,Battle Line: Medieval,boardgame,2017
6.57,1660708124.9633,6.332,2987,8116.0,1459,Pirate's plunder as they seek booty to bury and fame at the end of a cannon!,Pirate's Cove,boardgame,2002
7.76,1660708124.9633,6.331,271615,1058.0,1460,"You've made it to El Dorado, now the jewels and riches are almost in your grasp.",The Quest for El Dorado: The Golden Temples,boardgame,2019
7.38,1660708124.9633,6.331,2065,1677.0,1461,"Deploy captured pieces for rapid checkmates in Japan's traditional ""general's game.""",Shogi,boardgame,1587
7.69,1660708124.9633,6.331,328908,1191.0,1462,"Unravel the secret of The Key, a game within a game set in the year 1994.",The Initiative,boardgame,2021
6.98,1660708124.9633,6.331,103185,2253.0,1463,Starve and freeze on the plains as you build your farm and trade your goods in town.,Walnut Grove,boardgame,2011
8.16,1660708124.9633,6.331,61487,939.0,1464,Strategic level wargame with military and political decision-making in WWII Europe.,Unconditional Surrender! World War 2 in Europe,boardgame,2014
7.41,1660708124.9633,6.33,245354,1364.0,1465,A cooperative card game themed with Wizard of Oz.,Unlock!: Secret Adventures – The Adventurers of Oz,boardgame,2018
6.94,1660708124.9633,6.33,230267,2533.0,1466,"Settle your people, advance technology and fight for new territories in a new world.",Dice Settlers,boardgame,2018
6.69,1660708124.9633,6.33,1829,6963.0,1467,"Specialized commanders lead robot armies in a war for the earth, sea, and even moon.",Risk 2210 A.D.,boardgame,2001
8.47,1660708124.9633,6.329,296345,737.0,1468,"Be part of Holmes' gang of street children, tackling crime, mystery and a deadly foe.",Sherlock Holmes Consulting Detective: The Baker Street Irregulars,boardgame,2020
6.9,1660708124.9633,6.329,195856,3362.0,1469,The hunt is on! Take on nightmarish fiends and collect the most blood echoes.,Bloodborne: The Card Game,boardgame,2016
7.01,1660708124.9633,6.329,258444,2229.0,1470,Bake tasty treats to tempt fairy-tale characters who keep trying to eat your house!,Gingerbread House,boardgame,2018
7.09,1660708124.9633,6.328,38863,1956.0,1471,Make wise investments using shared resources but don't forget to donate to charity!,Hab & Gut,boardgame,2008
7.83,1660708124.9633,6.328,338760,999.0,1472,"Plan, build, and expand your railway network during the Industrial Age of Austria.",Imperial Steam,boardgame,2021
7.88,1660708124.9633,6.328,264198,1220.0,1473,"Scavenge, loot and survive the Fortress, FOR THE EMPEROR... or just yourself.",Warhammer Quest: Blackstone Fortress,boardgame,2018
7.82,1660708124.9633,6.328,325022,1062.0,1474,Develop coffee regions around the world while building your coffee trading network.,Coffee Traders,boardgame,2021
6.84,1660708124.9633,6.327,215840,2940.0,1475,Start an adventure in the mystic castle with wisdom and patience.,Exit: The Game – The Forbidden Castle,boardgame,2017
7.1,1660708124.9633,6.327,26,2163.0,1476,,Age of Renaissance,boardgame,1996
6.91,1660708124.9633,6.326,40270,2970.0,1477,Succeed at stories by facing down your opponent with your custom deck.,Call of Cthulhu: The Card Game,boardgame,2008
6.72,1660708124.9633,6.326,34887,4228.0,1478,"Decisions, decisions. Blackmail, bribe or threat? Connive to control the colony.",Revolution!,boardgame,2009
8.26,1660708124.9633,6.326,230889,940.0,1479,,Aristeia!,boardgame,2017
6.57,1660708124.9633,6.325,148951,7431.0,1480,Have your tiny kingdom expanded in the epic war of Aughmoore.,Tiny Epic Kingdoms,boardgame,2014
6.95,1660708124.9633,6.325,5206,2784.0,1481,The original asymetrical sci-fi wargame pits the mega-tank Ogre against lesser units.,Ogre,boardgame,1977
6.93,1660708124.9633,6.324,218530,2945.0,1482,Privateers capture Spanish gold for King and country. Maroon the disloyal to Tortuga!,Tortuga 1667,boardgame,2017
6.65,1660708124.9633,6.324,119,4807.0,1483,Vie for dominance by tactically placing tiles and castles over 3 epochs.,Kingdoms,boardgame,1994
9.3,1660708124.9633,6.323,251661,791.0,1484,Fight for humanity's survival against unnatural horrors and the Deepwood itself.,Oathsworn: Into the Deepwood,boardgame,2022
7.84,1660708124.9633,6.323,310448,1047.0,1485,Cooperate to protect your town from Zombie Hordes. A game that evolves as you play!,Zombie Teenz Evolution,boardgame,2020
7.12,1660708124.9633,6.322,300442,2002.0,1486,A light strategy game about the pleasures and wonders of world travel.,Trekking the World,boardgame,2020
7.14,1660708124.9633,6.321,248158,2252.0,1487,Assemble your heroes and defeat Thanos before SNAP!,Thanos Rising: Avengers Infinity War,boardgame,2018
6.74,1660708124.9633,6.32,39339,3828.0,1488,"Uncover a murder and a conspiracy, while living your own story, in a cyberpunk city.",Android,boardgame,2008
7.53,1660708124.9633,6.319,295607,1306.0,1489,Grow the most bountiful rainforest in this game of card drafting and set collection.,Canopy,boardgame,2021
7.57,1660708124.9633,6.319,249746,1271.0,1490,"Buy, bribe and murder your way to control of Victorian London's neighborhoods.",Nanty Narking,boardgame,2019
6.92,1660708124.9633,6.318,33451,3012.0,1491,4 new heroes join the party in this standalone expansion. Drink 'till you drop!,The Red Dragon Inn 2,boardgame,2008
6.54,1660708124.9633,6.318,915,7892.0,1492,Murder in medieval France. Explore stone halls. Examine clues. Find the culprit.,Mystery of the Abbey,boardgame,1995
7.72,1660708124.9633,6.318,225167,1578.0,1493,Secret teams try to rule the world after a successful machine revolution.,Human Punishment: Social Deduction 2.0,boardgame,2018
6.8,1660708124.9633,6.318,41933,3217.0,1494,"Fight, gamble and bluff in this desperate struggle for diminishing resources.",Arctic Scavengers,boardgame,2009
7.51,1660708124.9633,6.318,149776,1436.0,1495,Co-op strategic WW2 soldiers vs horrors.,Fireteam Zero,boardgame,2015
7.2,1660708124.9633,6.317,123607,1787.0,1496,Build a bag of gems and actions to overwhelm your opponent with gem damage!,Puzzle Strike: Third Edition,boardgame,2012
7.5,1660708124.9633,6.317,96007,1287.0,1497,,The New Era,boardgame,2011
7.03,1660708124.9633,6.316,30658,2057.0,1498,Compete to develop your ever-changing empire from Ancient Age to Modern Age.,Rise of Empires,boardgame,2009
6.8,1660708124.9633,6.316,34297,3043.0,1499,Use the blocks to build your way to the top!,The Climbers,boardgame,2008
