avg_rating,extracted_at,geek_rating,id,num_voters,rank,short_description,title,type,year_published
8.7,1660708124.9633,8.473,174430,51670.0,1,Vanquish monsters with strategic cardplay. Fulfill your quest to leave your legacy!,Gloomhaven,boardgame,2017
8.66,1660708124.9633,8.429,224517,30079.0,2,"Build networks, grow industries, and navigate the world of the Industrial Revolution.",Brass: Birmingham,boardgame,2018
8.58,1660708124.9633,8.426,161936,47368.0,3,Mutating diseases are spreading around the world - can your team save humanity?,Pandemic Legacy: Season 1,boardgame,2015
8.6,1660708124.9633,8.258,291457,21718.0,4,Vanquish monsters with strategic cardplay in a 25-scenario Gloomhaven campaign.,Gloomhaven: Jaws of the Lion,boardgame,2020
8.4,1660708124.9633,8.256,167791,80927.0,5,Compete with rival CEOs to make Mars habitable and build your corporate empire.,Terraforming Mars,boardgame,2016
8.64,1660708124.9633,8.246,233078,17962.0,6,"Build an intergalactic empire through trade, research, conquest and grand politics.",Twilight Imperium: Fourth Edition,boardgame,2017
8.64,1660708124.9633,8.239,342942,14469.0,7,"Plan and build a modern, scientifically managed zoo to support conservation projects.",Ark Nova,boardgame,2021
8.42,1660708124.9633,8.168,187645,27394.0,8,Strike from your hidden base as the Rebels—or find and destroy it as the Empire.,Star Wars: Rebellion,boardgame,2016
8.45,1660708124.9633,8.165,220308,21556.0,9,"Expand, research, upgrade, and settle the galaxy with one of 14 alien species.",Gaia Project,boardgame,2017
8.37,1660708124.9633,8.151,162886,37327.0,10,Island Spirits join forces using elemental powers to defend their home from invaders.,Spirit Island,boardgame,2017
8.52,1660708124.9633,8.149,115746,16948.0,11,The Fellowship and the Free Peoples clash with Sauron over the fate of Middle-Earth.,War of the Ring: Second Edition,boardgame,2011
8.35,1660708124.9633,8.125,182028,27309.0,12,Rewrite history as you build up your civilization in this epic card drafting game!,Through the Ages: A New Story of Civilization,boardgame,2015
8.28,1660708124.9633,8.109,193738,35534.0,13,Use strategic outposts and navigate danger as you herd your cattle to Kansas City.,Great Western Trail,boardgame,2016
8.27,1660708124.9633,8.101,12333,44597.0,14,Relive the Cold War and rewrite history in an epic clash between the USA and USSR.,Twilight Struggle,boardgame,2005
8.33,1660708124.9633,8.063,316554,23364.0,15,"Influence, intrigue, and combat in the universe of Dune.",Dune: Imperium,boardgame,2020
8.2,1660708124.9633,8.047,169786,69782.0,16,"Five factions vie for dominance in a war-torn, mech-filled, dieselpunk 1920s Europe.",Scythe,boardgame,2016
8.13,1660708124.9633,8.007,84876,53734.0,17,"Plan, trade, and build your Burgundian estate to prosperity and prominence.",The Castles of Burgundy,boardgame,2011
8.35,1660708124.9633,7.982,167355,21312.0,18,Survive an alien-infested spaceship but beware of other players and their agendas.,Nemesis,boardgame,2018
8.1,1660708124.9633,7.98,173346,76138.0,19,Science? Military? What will you draft to win this head-to-head version of 7 Wonders?,7 Wonders Duel,boardgame,2015
8.19,1660708124.9633,7.966,28720,21968.0,20,Test your economic mettle as you build and network in the Industrial Revolution.,Brass: Lancashire,boardgame,2007
8.12,1660708124.9633,7.965,124361,34038.0,21,Traders compete to build the greatest empire in the Roman Mediterranean.,Concordia,boardgame,2013
8.2,1660708124.9633,7.955,177736,22748.0,22,"Puzzle together the life of a Viking village as you hunt, farm, craft, and explore.",A Feast for Odin,boardgame,2016
8.11,1660708124.9633,7.948,120677,43529.0,23,Play fantastical factions.  Expand your influence by terraforming and joining cults.,Terra Mystica,boardgame,2012
8.09,1660708124.9633,7.937,266192,65694.0,24,Attract a beautiful and diverse collection of birds to your aviary.,Wingspan,boardgame,2019
8.15,1660708124.9633,7.921,205637,36264.0,25,Investigate the horrors of Arkham while courting cosmic doom.,Arkham Horror: The Card Game,boardgame,2016
8.63,1660708124.9633,7.907,266507,6350.0,26,"""Go forth, be bold, and ACQUIRE!"" in this campaign version of ""Clank!""",Clank!: Legacy – Acquisitions Incorporated,boardgame,2019
8.58,1660708124.9633,7.905,246900,7655.0,27,"Build an interstellar civilization by exploration, research, conquest, and diplomacy.",Eclipse: Second Dawn for the Galaxy,boardgame,2020
8.09,1660708124.9633,7.892,237182,36844.0,28,Decide the fate of the forest as woodland factions fight for contrasting goals.,Root,boardgame,2018
8.04,1660708124.9633,7.883,183394,38978.0,29,Create the most prosperous winery in Italy from the Tuscan vineyard you've inherited.,Viticulture Essential Edition,boardgame,2015
8.08,1660708124.9633,7.88,199792,35915.0,30,Gather resources to develop a harmonious village of woodland critters and structures.,Everdell,boardgame,2018
8.07,1660708124.9633,7.879,164928,26470.0,31,"Craftsmen, scholars & monks can help you reign supreme—but who will turn up to help?",Orléans,boardgame,2014
8.1,1660708124.9633,7.874,312484,25576.0,32,Explore an island to find resources and discover the lost ruins of Arnak.,Lost Ruins of Arnak,boardgame,2020
8.09,1660708124.9633,7.869,96848,30491.0,33,"Build your hero’s spells, abilities, and artifacts as you explore & conquer cities.",Mage Knight Board Game,boardgame,2011
8.1,1660708124.9633,7.832,175914,16864.0,34,Strategically hire and manage your workforce to outcompete rival fast food chains.,Food Chain Magnate,boardgame,2015
8.19,1660708124.9633,7.82,285774,17134.0,35,Battle Marvel villains with unique teams of iconic heroes in this LCG.,Marvel Champions: The Card Game,boardgame,2019
8.22,1660708124.9633,7.82,251247,11550.0,36,Nations vie for hydroelectric dominance in a dystopia where water is power.,Barrage,boardgame,2019
7.95,1660708124.9633,7.818,3076,67014.0,37,"Ship goods, construct buildings, and choose roles that benefit you more than others.",Puerto Rico,boardgame,2002
7.99,1660708124.9633,7.81,102794,30957.0,38,"From a simple cave, expand your dwarven home through mining, agriculture, and more.",Caverna: The Cave Farmers,boardgame,2013
8.4,1660708124.9633,7.807,192135,8984.0,39,Toss gobs of unique dice in an epic adventure en route to a final boss showdown.,Too Many Bones,boardgame,2017
7.97,1660708124.9633,7.8,170216,40356.0,40,Ragnarök has come! Secure your place in Valhalla in epic Viking battles.,Blood Rage,boardgame,2015
8.32,1660708124.9633,7.792,256960,8745.0,41,"Swing the tides of ""The Great Game"" as countries vie for control of Afghanistan.",Pax Pamir: Second Edition,boardgame,2019
7.91,1660708124.9633,7.792,31260,67969.0,42,Build your farmstead by sowing fields and raising livestock. But don't forget to eat!,Agricola,boardgame,2007
8.09,1660708124.9633,7.779,247763,14623.0,43,"Develop future cities on the seafloor through politics, production, and science.",Underwater Cities,boardgame,2018
8.14,1660708124.9633,7.767,276025,12470.0,44,Seafarers journey to obtain wealth and fame in the 17th century Caribbean.,Maracaibo,boardgame,2019
8.11,1660708124.9633,7.765,185343,14699.0,45,Use Exosuits & time travel to ensure your vision for the future after the cataclysm.,Anachrony,boardgame,2017
8.08,1660708124.9633,7.765,221107,14633.0,46,The world is a mystery after a devastating pandemic—where will your team go?,Pandemic Legacy: Season 2,boardgame,2017
8.0,1660708124.9633,7.761,205059,30733.0,47,Unravel mysteries in Arkham with your investigative team in this app-guided game.,Mansions of Madness: Second Edition,boardgame,2016
7.92,1660708124.9633,7.746,284083,30490.0,48,Go on a planet-discovering space mission in this cooperative trick-taking game.,The Crew: The Quest for Planet Nine,boardgame,2019
8.35,1660708124.9633,7.735,324856,6726.0,49,Dive into the deep sea in this co-operative trick-taking game.,The Crew: Mission Deep Sea,boardgame,2021
7.88,1660708124.9633,7.734,126163,34972.0,50,"Lead your people, build monuments and make offerings to earn the favour of the gods.",Tzolk'in: The Mayan Calendar,boardgame,2012
8.24,1660708124.9633,7.734,184267,9182.0,51,"Be a part of the first Martian colony, striving to be the best contributor.",On Mars,boardgame,2020
7.83,1660708124.9633,7.728,2651,60502.0,52,"Bid, network, and manage resources in a race to supply the most cities with power.",Power Grid,boardgame,2004
7.97,1660708124.9633,7.713,216132,17895.0,53,"Lead your unique Scottish clan to economic might via production, trade, and export.",Clans of Caledonia,boardgame,2017
7.87,1660708124.9633,7.707,35677,29142.0,54,"Establish a supply chain by collecting resources, building industries, and shipping.",Le Havre,boardgame,2008
7.99,1660708124.9633,7.706,164153,22655.0,55,Play as Rebel or Imperial forces to fulfill mission objectives.,Star Wars: Imperial Assault,boardgame,2014
8.56,1660708124.9633,7.704,55690,8539.0,56,Try to survive in a nightmarish world that lies under eternal darkness.,Kingdom Death: Monster,boardgame,2015
7.98,1660708124.9633,7.702,521,14542.0,57,Flick discs and make trick shots in this traditional Canadian dexterity game!,Crokinole,boardgame,1876
8.01,1660708124.9633,7.701,209010,15842.0,58,Cooperatively program and pilot your mechs to defeat an army of marauding minions.,Mechs vs. Minions,boardgame,2016
7.85,1660708124.9633,7.694,244521,35236.0,59,"Pull ingredients from your stock to make your pot bubble, but hopefully not explode!",The Quacks of Quedlinburg,boardgame,2018
8.55,1660708124.9633,7.694,314040,4851.0,60,Work together during the Cold War to prevent a Soviet bio-threat.,Pandemic Legacy: Season 0,boardgame,2020
8.05,1660708124.9633,7.688,125153,12076.0,61,"Amass a fortune, and stake your reputation by operating a lucrative art gallery.",The Gallerist,boardgame,2015
8.19,1660708124.9633,7.687,161533,8656.0,62,Compete to reconstruct the city of Lisboa after the great earthquake of 1755.,Lisboa,boardgame,2017
8.03,1660708124.9633,7.683,295947,13194.0,63,Create the most harmonious ecosystem as you puzzle together habitats and wildlife.,Cascadia,boardgame,2021
8.02,1660708124.9633,7.676,266810,13146.0,64,Invaders are coming from everywhere.  Keep the faith and defend your homeland.,Paladins of the West Kingdom,boardgame,2019
7.78,1660708124.9633,7.669,230802,69991.0,65,Artfully embellish the walls of your palace by drafting the most beautiful tiles.,Azul,boardgame,2017
7.98,1660708124.9633,7.667,180263,19953.0,66,Journey through a vibrant but deadly land to uncover the key to lifting your curse.,The 7th Continent,boardgame,2017
7.86,1660708124.9633,7.664,72125,27244.0,67,"Build an interstellar civilization by exploration, research, conquest, and diplomacy.",Eclipse,boardgame,2011
7.87,1660708124.9633,7.662,124742,28402.0,68,Megacorporation versus Netrunner in this futuristic cyberpunk game of cat and mouse.,Android: Netrunner,boardgame,2012
7.98,1660708124.9633,7.657,191189,15774.0,69,"Mages defend humanity’s last city, harnessing alien powers to destroy monstrosities.",Aeon's End,boardgame,2016
7.89,1660708124.9633,7.652,25613,18624.0,70,"Lead your civilization through strategic drafting of leaders, technologies, and more.",Through the Ages: A Story of Civilization,boardgame,2006
7.76,1660708124.9633,7.648,28143,50821.0,71,"Worlds await! Colonize, develop and conquer taking advantage of others' choices.",Race for the Galaxy,boardgame,2007
7.81,1660708124.9633,7.646,201808,35046.0,72,Claim your treasures but don't attract the dragon in this deck-building dungeon race.,Clank!: A Deck-Building Adventure,boardgame,2016
7.78,1660708124.9633,7.635,157354,36770.0,73,"Move assassins, elders & builders through Naqala to claim oases & control djinns.",Five Tribes,boardgame,2014
8.06,1660708124.9633,7.634,159675,9607.0,74,"Construct dikes, drain bogs, harvest flax and tend to newborn animals in East Frisia.",Fields of Arle,boardgame,2014
7.9,1660708124.9633,7.63,229853,16605.0,75,Use your worker dice to raise the legendary and breathtaking Pyramid of the Sun.,Teotihuacan: City of Gods,boardgame,2018
7.8,1660708124.9633,7.628,121921,38934.0,76,Work together — with friends or with Friday — to survive on a deserted island.,Robinson Crusoe: Adventures on the Cursed Island,boardgame,2012
7.98,1660708124.9633,7.626,200680,13348.0,77,"Help your farm to prosper in this updated, streamlined edition of the acclaimed game.",Agricola (Revised Edition),boardgame,2016
7.82,1660708124.9633,7.622,171623,22740.0,78,"Using unique abilities, fulfill contracts and reach your goals along the Silk Road.",The Voyages of Marco Polo,boardgame,2015
7.89,1660708124.9633,7.621,182874,16025.0,79,Serve guests and prepare rooms to be the best hotelier in the Viennese modern age.,Grand Austria Hotel,boardgame,2015
7.72,1660708124.9633,7.615,68448,94006.0,80,Draft cards to develop your ancient civilization and build its Wonder of the World.,7 Wonders,boardgame,2010
7.75,1660708124.9633,7.611,110327,50657.0,81,Deploy agents and hire adventurers to expand your control over the city of Waterdeep.,Lords of Waterdeep,boardgame,2012
7.83,1660708124.9633,7.603,62219,19337.0,82,"With an ice age approaching, which animals will best propagate, migrate, and adapt?",Dominant Species,boardgame,2010
8.54,1660708124.9633,7.598,284378,4252.0,83,EV-factory workers optimize and innovate to stand out at the big board meeting.,Kanban EV,boardgame,2020
8.2,1660708124.9633,7.589,264220,9479.0,84,"Exploration, battle and diplomacy in a dark Arthurian realm.",Tainted Grail: The Fall of Avalon,boardgame,2019
7.79,1660708124.9633,7.58,236457,23035.0,85,Will you be a virtuous or nefarious servant of the king? Build your way to glory.,Architects of the West Kingdom,boardgame,2018
8.44,1660708124.9633,7.57,255984,4789.0,86,"Voyages of the steamship ""Manticore"" and her crew on the Wandering Sea.",Sleeping Gods,boardgame,2021
7.74,1660708124.9633,7.568,93,25474.0,87,"Use your caballeros to control regions of medieval Spain, keeping clear of the King!",El Grande,boardgame,1995
7.76,1660708124.9633,7.567,122515,20932.0,88,Compete in a unique auction system to build the most prosperous village.,Keyflower,boardgame,2012
7.74,1660708124.9633,7.559,18602,27982.0,89,Entrepreneurs pay workers & bribe an official to build a Château & gain royal favor.,Caylus,boardgame,2005
7.74,1660708124.9633,7.556,37111,34696.0,90,How can the human race survive when you don't know who is actually human?,Battlestar Galactica: The Board Game,boardgame,2008
7.87,1660708124.9633,7.544,172386,12177.0,91,Acquire shares of unique companies and propagate their trading posts to rake in cash.,Mombasa,boardgame,2015
7.74,1660708124.9633,7.543,73439,21172.0,92,"Defend the city and rise to power by influencing the merchants, knights and clergy.",Troyes,boardgame,2010
7.7,1660708124.9633,7.541,40834,31959.0,93,"Enlist torturers, swindlers, and saboteurs to gain wealth and dominate the kingdom.",Dominion: Intrigue,boardgame,2009
7.81,1660708124.9633,7.539,12493,18867.0,94,"Epic empire-building game of interstellar conflict, trade, and struggle for power.",Twilight Imperium: Third Edition,boardgame,2005
7.76,1660708124.9633,7.538,170042,20001.0,95,Gather your Viking crew in order to plunder seas and lands for glory!,Raiders of the North Sea,boardgame,2015
7.97,1660708124.9633,7.538,269385,12819.0,96,"Heroes explore Middle-earth, working together to combat evil in an epic campaign.",The Lord of the Rings: Journeys in Middle-Earth,boardgame,2019
7.77,1660708124.9633,7.536,146021,32867.0,97,An unknown Elder God approaches the world—and you must solve mysteries to stop it.,Eldritch Horror,boardgame,2013
8.0,1660708124.9633,7.532,317985,8128.0,98,Collectively develop a tech tree to fuel the automation and colonization of space.,Beyond the Sun,boardgame,2020
7.87,1660708124.9633,7.531,203993,11785.0,99,Avoid excommunication and lead your family to power during the Italian Renaissance.,Lorenzo il Magnifico,boardgame,2016
7.7,1660708124.9633,7.527,42,26972.0,100,Keep your Mesopotamian civilisation in perfect balance through revolutions and wars.,Tigris & Euphrates,boardgame,1997
7.79,1660708124.9633,7.524,225694,16480.0,101,Decipher your opponents' code before they decipher yours. Don't get caught.,Decrypto,boardgame,2018
7.75,1660708124.9633,7.518,144733,16535.0,102,"Acquire locomotives & industry, build track, and hire the best engineers in Russia.",Russian Railroads,boardgame,2013
7.62,1660708124.9633,7.518,163412,56135.0,103,Piece together a quilt and leave no holes to become the button master.,Patchwork,boardgame,2014
7.84,1660708124.9633,7.518,281259,14856.0,104,Rescue as many cats as you can before Lord Vesh comes to destroy their home.,The Isle of Cats,boardgame,2019
7.82,1660708124.9633,7.516,155821,15959.0,105,Claim the crown through merit and wisdom in this Celtic island struggle.,Inis,boardgame,2016
7.81,1660708124.9633,7.515,205896,18688.0,106,"Lead your clan to victory through negotiation, combat, monsters and favors from Kami.",Rising Sun,boardgame,2018
7.76,1660708124.9633,7.508,102680,16173.0,107,Manage and rule all aspects of Ancient Rome with a clever action selection mancala.,Trajan,boardgame,2011
8.14,1660708124.9633,7.507,253344,7113.0,108,Disrupt the ritual and slay the Elder Gods in this co-op dice chucker.,Cthulhu: Death May Die,boardgame,2019
7.84,1660708124.9633,7.496,233371,11895.0,109,Tiptoe your way through Lord Eradikus' spaceship to nab artifacts and an escape pod.,Clank! In! Space!: A Deck-Building Adventure,boardgame,2017
7.96,1660708124.9633,7.494,163068,8564.0,110,Magicians perform dazzling tricks for money and fame in a Victorian steampunk world.,Trickerion: Legends of Illusion,boardgame,2015
7.61,1660708124.9633,7.492,36218,84090.0,111,Acquire the most valuable lands by building your deck with treasure and power cards.,Dominion,boardgame,2008
8.34,1660708124.9633,7.49,218417,4578.0,112,War Eternal is a standalone game compatible with the deck building game Aeon's End.,Aeon's End: War Eternal,boardgame,2017
7.58,1660708124.9633,7.489,178900,78903.0,113,Give your team clever one-word clues to help them spot their agents in the field.,Codenames,boardgame,2015
7.63,1660708124.9633,7.485,132531,29329.0,114,"Utilize your dice populace to develop technologies, settle worlds, and ship goods.",Roll for the Galaxy,boardgame,2014
8.52,1660708124.9633,7.481,341169,3565.0,115,Wrangle your herd of cows across the Midwest prairie and deliver it to Kansas City.,Great Western Trail (Second Edition),boardgame,2021
7.91,1660708124.9633,7.479,198928,9330.0,116,"Travel from Barcelona to Lisboa to cure malaria, typhus, yellow fever, and cholera.",Pandemic: Iberia,boardgame,2016
7.75,1660708124.9633,7.477,172287,15506.0,117,"Gain glory by defending a Viking harbor town against trolls, draugr and other beasts.",Champions of Midgard,boardgame,2015
7.83,1660708124.9633,7.474,196340,10399.0,118,Claim your fame as the dominant merchant in the Meiji period of Yokohama.,Yokohama,boardgame,2016
7.68,1660708124.9633,7.473,263918,20712.0,119,Explore lands on behalf of the queen and draw the most proficient maps to earn favor.,Cartographers,boardgame,2019
7.75,1660708124.9633,7.47,266524,16562.0,120,"Hike through National Parks tiles, collecting memories and admiring gorgeous scenery.",PARKS,boardgame,2019
7.57,1660708124.9633,7.47,30549,113532.0,121,Your team of experts must prevent the world from succumbing to a viral pandemic.,Pandemic,boardgame,2008
7.97,1660708124.9633,7.469,175155,8349.0,122,"Assemble your armies, devise your strategy, and wage war across the Herakon Cluster.",Forbidden Stars,boardgame,2015
8.15,1660708124.9633,7.469,175640,5471.0,123,The strategic craft of fine winemaking.,Vinhos: Deluxe Edition,boardgame,2016
7.73,1660708124.9633,7.467,262712,16592.0,124,"Rival mages create artifacts, vying for places of power and ancient monuments.",Res Arcana,boardgame,2019
7.68,1660708124.9633,7.46,2511,19325.0,125,The game is afoot as you and your irregular friends search Victorian London for clues,Sherlock Holmes Consulting Detective: The Thames Murders & Other Cases,boardgame,1982
8.09,1660708124.9633,7.458,279537,5776.0,126,"Plan, scan, and theorize to find a new planet at the edge of our solar system.",The Search for Planet X,boardgame,2020
7.69,1660708124.9633,7.457,127023,17828.0,127,Play as warring Egyptian Gods and build the most powerful army to dominate Egypt.,Kemet,boardgame,2012
7.81,1660708124.9633,7.452,4098,9905.0,128,"Outperform your railroad rivals with shares, auctions, trackbuilding, and deliveries.",Age of Steam,boardgame,2002
7.64,1660708124.9633,7.442,118048,19001.0,129,A contest between two nomadic tribes along desert trade routes.,Targi,boardgame,2012
7.71,1660708124.9633,7.441,43015,13455.0,130,Build networks of merchants along the roads and market towns of the Hanseatic League.,Hansa Teutonica,boardgame,2009
7.87,1660708124.9633,7.438,274364,8506.0,131,Hide or expose the greatest American political scandal in a tug of war for evidence.,Watergate,boardgame,2019
7.95,1660708124.9633,7.438,233398,7869.0,132,"Spread your glory over the vast, as of yet unexplored world in this updated classic.",Endeavor: Age of Sail,boardgame,2018
7.66,1660708124.9633,7.438,161970,20534.0,133,Showcase your alchemical know-how by publishing theories in this app-driven game.,Alchemists,boardgame,2014
8.32,1660708124.9633,7.437,231733,4422.0,134,"Renovate an estate, manage servants, and pursue romance in Victorian England.",Obsession,boardgame,2018
7.57,1660708124.9633,7.432,147020,40390.0,135,Compete head-to-head to create the most powerful deck of spaceships and bases.,Star Realms,boardgame,2014
7.77,1660708124.9633,7.432,271324,12156.0,136,"Draft yourself the ‘perfect’ dystopia, complete projects and churn out resources.",It's a Wonderful World,boardgame,2019
7.77,1660708124.9633,7.432,146652,12384.0,137,"In space, no one can hear you build a deck of marine & weapon cards to fight aliens.",Legendary Encounters: An Alien Deck Building Game,boardgame,2014
7.55,1660708124.9633,7.429,34635,48791.0,138,Travel to the time of hunters and gatherers in this classic game of tools and tribes.,Stone Age,boardgame,2008
7.66,1660708124.9633,7.427,103885,24135.0,139,Pilot your ships in tight arcs to take out the enemy! The universe can be yours.,Star Wars: X-Wing Miniatures Game,boardgame,2012
7.64,1660708124.9633,7.422,217372,17976.0,140,Race through a dense South American jungle in pursuit of the legendary city of gold.,The Quest for El Dorado,boardgame,2017
8.31,1660708124.9633,7.422,256916,3936.0,141,Traders compete to build the greatest empire in the Roman Mediterranean.,Concordia Venus,boardgame,2018
7.54,1660708124.9633,7.419,14996,66592.0,142,Build train routes across Europe in this sequel to the hit family board game.,Ticket to Ride: Europe,boardgame,2005
7.58,1660708124.9633,7.417,233867,24495.0,143,"Design the most appealing 1950s neighborhood, with fences, parks, and swimming pools.",Welcome To...,boardgame,2018
7.56,1660708124.9633,7.41,148949,28381.0,144,Send your assistants through the shops of Istanbul as you race to acquire rubies.,Istanbul,boardgame,2014
7.66,1660708124.9633,7.409,77423,22704.0,145,Guide your fellowship as it embarks on unique adventures in Tolkien's Middle-earth!,The Lord of the Rings: The Card Game,boardgame,2011
7.62,1660708124.9633,7.408,254640,18827.0,146,"Give one-word clues so someone can guess one word, but duplicate clues are discarded.",Just One,boardgame,2018
7.73,1660708124.9633,7.403,220877,11439.0,147,Manage your dice to build profitable markets and grand monuments in historic India.,Rajas of the Ganges,boardgame,2017
8.03,1660708124.9633,7.402,308765,5813.0,148,Wealthy citizens of medieval Prague organize building projects to gain king's favor.,Praga Caput Regni,boardgame,2020
7.61,1660708124.9633,7.402,244522,19516.0,149,"Draft dice to mark numbers on your scoresheet, comboing bonuses to power your points.",That's Pretty Clever!,boardgame,2018
7.88,1660708124.9633,7.399,82222,8752.0,150,Pilot your ship to stardom in a massive sci-fi sandbox.,Xia: Legends of a Drift System,boardgame,2014
7.73,1660708124.9633,7.397,287954,11796.0,151,You're an artisan working on creating striking patterns within a king's palace.,Azul: Summer Pavilion,boardgame,2019
8.05,1660708124.9633,7.396,283948,5505.0,152,"Travel to cities along the silk road, trading silk, spice, gold & jade along the way.",Marco Polo II: In the Service of the Khan,boardgame,2019
7.78,1660708124.9633,7.396,9609,10331.0,153,"Rings, Fellowship, diplomacy and war in the Third Age of Middle Earth.",War of the Ring,boardgame,2004
7.67,1660708124.9633,7.394,43111,14934.0,154,Rival chaos gods send forth their minions to spread corruption and destruction.,Chaos in the Old World,boardgame,2009
7.65,1660708124.9633,7.394,104162,24161.0,155,Fight the Overlord and level up your heroes in this fantasy dungeon campaign.,Descent: Journeys in the Dark (Second Edition),boardgame,2012
7.5,1660708124.9633,7.386,54043,43960.0,156,Trade and sell goods to become the most wealthy merchant in this short game for two.,Jaipur,boardgame,2009
7.97,1660708124.9633,7.381,265188,6036.0,157,"Expand your Scottish clan by trading livestock, making whisky and gaining landmarks.",Glen More II: Chronicles,boardgame,2019
7.55,1660708124.9633,7.38,463,35853.0,158,Cast spells and summon fantasy monsters in the original collectible card game.,Magic: The Gathering,boardgame,1993
7.93,1660708124.9633,7.379,296151,6805.0,159,Travel the Kingdom seeking upgrades in an attempt to bring poverty or prosperity.,Viscounts of the West Kingdom,boardgame,2020
7.55,1660708124.9633,7.376,10630,27774.0,160,Revisit the battles of D-Day and control the forces of the Allies and the Axis!,Memoir '44,boardgame,2004
