avg_rating,extracted_at,geek_rating,id,num_voters,rank,short_description,title,type,year_published
8.71,1658288330.651143,8.476,174430,51245.0,1,Vanquish monsters with strategic cardplay. Fulfill your quest to leave your legacy!,Gloomhaven,boardgame,2017
8.58,1658288330.651143,8.429,161936,47115.0,2,Mutating diseases are spreading around the world - can your team save humanity?,Pandemic Legacy: Season 1,boardgame,2015
8.66,1658288330.651143,8.426,224517,29525.0,3,"Build networks, grow industries, and navigate the world of the Industrial Revolution.",Brass: Birmingham,boardgame,2018
8.61,1658288330.651143,8.261,291457,21134.0,4,Vanquish monsters with strategic cardplay in a 25-scenario Gloomhaven campaign.,Gloomhaven: Jaws of the Lion,boardgame,2020
8.4,1658288330.651143,8.258,167791,80192.0,5,Compete with rival CEOs to make Mars habitable and build your corporate empire.,Terraforming Mars,boardgame,2016
8.65,1658288330.651143,8.247,233078,17725.0,6,"Build an intergalactic empire through trade, research, conquest and grand politics.",Twilight Imperium: Fourth Edition,boardgame,2017
8.66,1658288330.651143,8.212,342942,12686.0,7,"Plan and build a modern, scientifically managed zoo to support conservation projects.",Ark Nova,boardgame,2021
8.42,1658288330.651143,8.168,187645,27183.0,8,Strike from your hidden base as the Rebels—or find and destroy it as the Empire.,Star Wars: Rebellion,boardgame,2016
8.45,1658288330.651143,8.165,220308,21301.0,9,"Expand, research, upgrade, and settle the galaxy with one of 14 alien species.",Gaia Project,boardgame,2017
8.37,1658288330.651143,8.149,162886,36680.0,10,Island Spirits join forces using elemental powers to defend their home from invaders.,Spirit Island,boardgame,2017
8.52,1658288330.651143,8.146,115746,16762.0,11,The Fellowship and the Free Peoples clash with Sauron over the fate of Middle-Earth.,War of the Ring: Second Edition,boardgame,2011
8.36,1658288330.651143,8.126,182028,27127.0,12,Rewrite history as you build up your civilization in this epic card drafting game!,Through the Ages: A New Story of Civilization,boardgame,2015
8.28,1658288330.651143,8.111,193738,35280.0,13,Use strategic outposts and navigate danger as you herd your cattle to Kansas City.,Great Western Trail,boardgame,2016
8.27,1658288330.651143,8.102,12333,44428.0,14,Relive the Cold War and rewrite history in an epic clash between the USA and USSR.,Twilight Struggle,boardgame,2005
8.33,1658288330.651143,8.054,316554,22472.0,15,"Influence, intrigue, and combat in the universe of Dune.",Dune: Imperium,boardgame,2020
8.2,1658288330.651143,8.048,169786,69278.0,16,"Five factions vie for dominance in a war-torn, mech-filled, dieselpunk 1920s Europe.",Scythe,boardgame,2016
8.13,1658288330.651143,8.006,84876,53409.0,17,"Plan, trade, and build your Burgundian estate to prosperity and prominence.",The Castles of Burgundy,boardgame,2011
8.35,1658288330.651143,7.984,167355,20919.0,18,Survive an alien-infested spaceship but beware of other players and their agendas.,Nemesis,boardgame,2018
8.1,1658288330.651143,7.981,173346,75428.0,19,Science? Military? What will you draft to win this head-to-head version of 7 Wonders?,7 Wonders Duel,boardgame,2015
8.19,1658288330.651143,7.966,28720,21839.0,20,Test your economic mettle as you build and network in the Industrial Revolution.,Brass: Lancashire,boardgame,2007
8.12,1658288330.651143,7.965,124361,33772.0,21,Traders compete to build the greatest empire in the Roman Mediterranean.,Concordia,boardgame,2013
8.2,1658288330.651143,7.955,177736,22498.0,22,"Puzzle together the life of a Viking village as you hunt, farm, craft, and explore.",A Feast for Odin,boardgame,2016
8.11,1658288330.651143,7.951,120677,43359.0,23,Play fantastical factions.  Expand your influence by terraforming and joining cults.,Terra Mystica,boardgame,2012
8.09,1658288330.651143,7.937,266192,64607.0,24,Attract a beautiful and diverse collection of birds to your wildlife reserve.,Wingspan,boardgame,2019
8.15,1658288330.651143,7.922,205637,35939.0,25,Investigate the horrors of Arkham while courting cosmic doom.,Arkham Horror: The Card Game,boardgame,2016
8.64,1658288330.651143,7.9,266507,6183.0,26,"""Go forth, be bold, and ACQUIRE!"" in this campaign version of ""Clank!""",Clank!: Legacy – Acquisitions Incorporated,boardgame,2019
8.6,1658288330.651143,7.9,246900,7386.0,27,"Build an interstellar civilization by exploration, research, conquest, and diplomacy.",Eclipse: Second Dawn for the Galaxy,boardgame,2020
8.1,1658288330.651143,7.894,237182,36254.0,28,Decide the fate of the forest as woodland factions fight for contrasting goals.,Root,boardgame,2018
8.04,1658288330.651143,7.884,183394,38517.0,29,Create the most prosperous winery in Italy from the Tuscan vineyard you've inherited.,Viticulture Essential Edition,boardgame,2015
8.09,1658288330.651143,7.884,199792,35137.0,30,Gather resources to develop a harmonious village of woodland critters and structures.,Everdell,boardgame,2018
8.07,1658288330.651143,7.88,164928,26270.0,31,"Craftsmen, scholars & monks can help you reign supreme—but who will turn up to help?",Orléans,boardgame,2014
8.11,1658288330.651143,7.874,312484,24737.0,32,Explore an island to find resources and discover the lost ruins of Arnak.,Lost Ruins of Arnak,boardgame,2020
8.09,1658288330.651143,7.87,96848,30332.0,33,"Build your hero’s spells, abilities, and artifacts as you explore & conquer cities.",Mage Knight Board Game,boardgame,2011
8.11,1658288330.651143,7.832,175914,16699.0,34,Strategically hire and manage your workforce to outcompete rival fast food chains.,Food Chain Magnate,boardgame,2015
7.95,1658288330.651143,7.819,3076,66848.0,35,"Ship goods, construct buildings, and choose roles that benefit you more than others.",Puerto Rico,boardgame,2002
8.19,1658288330.651143,7.817,285774,16788.0,36,Battle Marvel villains with unique teams of iconic heroes in this LCG.,Marvel Champions: The Card Game,boardgame,2019
8.22,1658288330.651143,7.816,251247,11285.0,37,Nations vie for hydroelectric dominance in a dystopia where water is power.,Barrage,boardgame,2019
8.41,1658288330.651143,7.813,192135,8857.0,38,Toss gobs of unique dice in an epic adventure en route to a final boss showdown.,Too Many Bones,boardgame,2017
7.99,1658288330.651143,7.812,102794,30866.0,39,"From a simple cave, expand your dwarven home through mining, agriculture, and more.",Caverna: The Cave Farmers,boardgame,2013
7.98,1658288330.651143,7.802,170216,40069.0,40,Ragnarök has come! Secure your place in Valhalla in epic Viking battles.,Blood Rage,boardgame,2015
7.91,1658288330.651143,7.794,31260,67774.0,41,Build your farmstead by sowing fields and raising livestock. But don't forget to eat!,Agricola,boardgame,2007
8.33,1658288330.651143,7.789,256960,8538.0,42,"Swing the tides of ""The Great Game"" as countries vie for control of Afghanistan.",Pax Pamir: Second Edition,boardgame,2019
8.09,1658288330.651143,7.779,247763,14441.0,43,"Develop future cities on the seafloor through politics, production, and science.",Underwater Cities,boardgame,2018
8.14,1658288330.651143,7.77,276025,12294.0,44,Seafarers journey to obtain wealth and fame in the 17th century Caribbean.,Maracaibo,boardgame,2019
8.09,1658288330.651143,7.768,221107,14514.0,45,The world is a mystery after a devastating pandemic—where will your team go?,Pandemic Legacy: Season 2,boardgame,2017
8.11,1658288330.651143,7.765,185343,14565.0,46,Use Exosuits & time travel to ensure your vision for the future after the cataclysm.,Anachrony,boardgame,2017
8.0,1658288330.651143,7.763,205059,30482.0,47,Unravel mysteries in Arkham with your investigative team in this app-guided game.,Mansions of Madness: Second Edition,boardgame,2016
7.92,1658288330.651143,7.75,284083,29917.0,48,Go on a planet-discovering space mission in this cooperative trick-taking game.,The Crew: The Quest for Planet Nine,boardgame,2019
7.89,1658288330.651143,7.734,126163,34791.0,49,"Lead your people, build monuments and make offerings to earn the favour of the gods.",Tzolk'in: The Mayan Calendar,boardgame,2012
8.24,1658288330.651143,7.731,184267,9006.0,50,"Be a part of the first Martian colony, striving to be the best contributor.",On Mars,boardgame,2020
7.84,1658288330.651143,7.729,2651,60289.0,51,"Bid, network, and manage resources in a race to supply the most cities with power.",Power Grid,boardgame,2004
7.97,1658288330.651143,7.713,216132,17783.0,52,"Lead your unique Scottish clan to economic might via production, trade, and export.",Clans of Caledonia,boardgame,2017
7.87,1658288330.651143,7.708,35677,29043.0,53,"Establish a supply chain by collecting resources, building industries, and shipping.",Le Havre,boardgame,2008
8.36,1658288330.651143,7.708,324856,6268.0,54,Dive into the deep sea in this co-operative trick-taking game.,The Crew: Mission Deep Sea,boardgame,2021
8.57,1658288330.651143,7.707,55690,8483.0,55,Try to survive in a nightmarish world that lies under eternal darkness.,Kingdom Death: Monster,boardgame,2015
7.99,1658288330.651143,7.707,164153,22563.0,56,Play as Rebel or Imperial forces to fulfill mission objectives.,Star Wars: Imperial Assault,boardgame,2014
8.01,1658288330.651143,7.704,209010,15768.0,57,Cooperatively program and pilot your mechs to defeat an army of marauding minions.,Mechs vs. Minions,boardgame,2016
7.97,1658288330.651143,7.696,521,14395.0,58,Flick discs and make trick shots in this traditional Canadian dexterity game!,Crokinole,boardgame,1876
7.85,1658288330.651143,7.693,244521,34642.0,59,"Pull ingredients from your stock to make your pot bubble, but hopefully not explode!",The Quacks of Quedlinburg,boardgame,2018
8.56,1658288330.651143,7.691,314040,4736.0,60,Work together during the Cold War to prevent a Soviet bio-threat.,Pandemic Legacy: Season 0,boardgame,2020
8.19,1658288330.651143,7.686,161533,8563.0,61,Compete to reconstruct the city of Lisboa after the great earthquake of 1755.,Lisboa,boardgame,2017
8.05,1658288330.651143,7.685,125153,11967.0,62,"Amass a fortune, and stake your reputation by operating a lucrative art gallery.",The Gallerist,boardgame,2015
8.02,1658288330.651143,7.675,266810,12936.0,63,Invaders are coming from everywhere.  Keep the faith and defend your homeland.,Paladins of the West Kingdom,boardgame,2019
7.99,1658288330.651143,7.674,180263,19851.0,64,Journey through a vibrant but deadly land to uncover the key to lifting your curse.,The 7th Continent,boardgame,2017
7.78,1658288330.651143,7.671,230802,69246.0,65,Artfully embellish the walls of your palace by drafting the most beautiful tiles.,Azul,boardgame,2017
7.86,1658288330.651143,7.666,72125,27206.0,66,"Build an interstellar civilization by exploration, research, conquest, and diplomacy.",Eclipse,boardgame,2011
8.04,1658288330.651143,7.664,295947,12001.0,67,Create the most harmonious ecosystem as you puzzle together habitats and wildlife.,Cascadia,boardgame,2021
7.87,1658288330.651143,7.662,124742,28333.0,68,Megacorporation versus Netrunner in this futuristic cyberpunk game of cat and mouse.,Android: Netrunner,boardgame,2012
7.98,1658288330.651143,7.658,191189,15590.0,69,"Mages defend humanity’s last city, harnessing alien powers to destroy monstrosities.",Aeon's End,boardgame,2016
7.89,1658288330.651143,7.655,25613,18593.0,70,"Lead your civilization through strategic drafting of leaders, technologies, and more.",Through the Ages: A Story of Civilization,boardgame,2006
7.76,1658288330.651143,7.648,28143,50585.0,71,"Worlds await! Colonize, develop and conquer taking advantage of others' choices.",Race for the Galaxy,boardgame,2007
7.81,1658288330.651143,7.646,201808,34687.0,72,Claim your treasures but don't attract the dragon in this deck-building dungeon race.,Clank!: A Deck-Building Adventure,boardgame,2016
7.78,1658288330.651143,7.635,157354,36547.0,73,"Move assassins, elders & builders through Naqala to claim oases & control djinns.",Five Tribes,boardgame,2014
8.06,1658288330.651143,7.635,159675,9563.0,74,"Construct dikes, drain bogs, harvest flax and tend to newborn animals in East Frisia.",Fields of Arle,boardgame,2014
7.91,1658288330.651143,7.632,229853,16464.0,75,Use your worker dice to raise the legendary and breathtaking Pyramid of the Sun.,Teotihuacan: City of Gods,boardgame,2018
7.8,1658288330.651143,7.63,121921,38747.0,76,Work together — with friends or with Friday — to survive on a deserted island.,Robinson Crusoe: Adventures on the Cursed Island,boardgame,2012
7.98,1658288330.651143,7.624,200680,13162.0,77,"Help your farm to prosper in this updated, streamlined edition of the acclaimed game.",Agricola (Revised Edition),boardgame,2016
7.82,1658288330.651143,7.624,171623,22649.0,78,"Using unique abilities, fulfill contracts and reach your goals along the Silk Road.",The Voyages of Marco Polo,boardgame,2015
7.89,1658288330.651143,7.617,182874,15860.0,79,Serve guests and prepare rooms to be the best hotelier in the Viennese modern age.,Grand Austria Hotel,boardgame,2015
7.72,1658288330.651143,7.617,68448,93549.0,80,Draft cards to develop your ancient civilization and build its Wonder of the World.,7 Wonders,boardgame,2010
7.75,1658288330.651143,7.612,110327,50445.0,81,Deploy agents and hire adventurers to expand your control over the city of Waterdeep.,Lords of Waterdeep,boardgame,2012
7.83,1658288330.651143,7.604,62219,19273.0,82,"With an ice age approaching, which animals will best propagate, migrate, and adapt?",Dominant Species,boardgame,2010
8.21,1658288330.651143,7.589,264220,9328.0,83,"Exploration, battle and diplomacy in a dark Arthurian realm.",Tainted Grail: The Fall of Avalon,boardgame,2019
8.55,1658288330.651143,7.583,284378,4094.0,84,EV-factory workers optimize and innovate to stand out at the big board meeting.,Kanban EV,boardgame,2020
7.79,1658288330.651143,7.58,236457,22783.0,85,Will you be a virtuous or nefarious servant of the king? Build your way to glory.,Architects of the West Kingdom,boardgame,2018
7.75,1658288330.651143,7.57,93,25382.0,86,"Use your caballeros to control regions of medieval Spain, keeping clear of the King!",El Grande,boardgame,1995
7.76,1658288330.651143,7.569,122515,20844.0,87,Compete in a unique auction system to build the most prosperous village.,Keyflower,boardgame,2012
7.74,1658288330.651143,7.561,18602,27926.0,88,Entrepreneurs pay workers & bribe an official to build a Château & gain royal favor.,Caylus,boardgame,2005
7.74,1658288330.651143,7.558,37111,34614.0,89,How can the human race survive when you don't know who is actually human?,Battlestar Galactica: The Board Game,boardgame,2008
8.45,1658288330.651143,7.546,255984,4571.0,90,"Voyages of the steamship ""Manticore"" and her crew on the Wandering Sea.",Sleeping Gods,boardgame,2021
7.74,1658288330.651143,7.544,73439,21064.0,91,"Defend the city and rise to power by influencing the merchants, knights and clergy.",Troyes,boardgame,2010
7.87,1658288330.651143,7.544,172386,12111.0,92,Acquire shares of unique companies and propagate their trading posts to rake in cash.,Mombasa,boardgame,2015
7.7,1658288330.651143,7.543,40834,31878.0,93,"Enlist torturers, swindlers, and saboteurs to gain wealth and dominate the kingdom.",Dominion: Intrigue,boardgame,2009
7.82,1658288330.651143,7.542,12493,18839.0,94,"Epic empire-building game of interstellar conflict, trade, and struggle for power.",Twilight Imperium: Third Edition,boardgame,2005
7.76,1658288330.651143,7.539,170042,19827.0,95,Gather your Viking crew in order to plunder seas and lands for glory!,Raiders of the North Sea,boardgame,2015
7.77,1658288330.651143,7.538,146021,32724.0,96,An unknown Elder God approaches the world—and you must solve mysteries to stop it.,Eldritch Horror,boardgame,2013
7.98,1658288330.651143,7.537,269385,12654.0,97,"Heroes explore Middle-earth, working together to combat evil in an epic campaign.",The Lord of the Rings: Journeys in Middle-Earth,boardgame,2019
7.88,1658288330.651143,7.533,203993,11672.0,98,Avoid excommunication and lead your family to power during the Italian Renaissance.,Lorenzo il Magnifico,boardgame,2016
7.7,1658288330.651143,7.528,42,26867.0,99,Keep your Mesopotamian civilisation in perfect balance through revolutions and wars.,Tigris & Euphrates,boardgame,1997
7.79,1658288330.651143,7.524,225694,16260.0,100,Decipher your opponents' code before they decipher yours. Don't get caught.,Decrypto,boardgame,2018
7.76,1658288330.651143,7.52,144733,16460.0,101,"Acquire locomotives & industry, build track, and hire the best engineers in Russia.",Russian Railroads,boardgame,2013
7.63,1658288330.651143,7.52,163412,55764.0,102,Piece together a quilt and leave no holes to become the button master.,Patchwork,boardgame,2014
7.84,1658288330.651143,7.518,281259,14529.0,103,Rescue as many cats as you can before Lord Vesh comes to destroy their home.,The Isle of Cats,boardgame,2019
8.01,1658288330.651143,7.515,317985,7692.0,104,Collectively develop a tech tree to fuel the automation and colonization of space.,Beyond the Sun,boardgame,2020
7.81,1658288330.651143,7.515,205896,18558.0,105,"Lead your clan to victory through negotiation, combat, monsters and favors from Kami.",Rising Sun,boardgame,2018
7.82,1658288330.651143,7.511,155821,15776.0,106,Claim the crown through merit and wisdom in this Celtic island struggle.,Inis,boardgame,2016
7.76,1658288330.651143,7.508,102680,16112.0,107,Manage and rule all aspects of Ancient Rome with a clever action selection mancala.,Trajan,boardgame,2011
8.14,1658288330.651143,7.5,253344,6978.0,108,Disrupt the ritual and slay the Elder Gods in this co-op dice chucker.,Cthulhu: Death May Die,boardgame,2019
7.84,1658288330.651143,7.496,233371,11776.0,109,Tiptoe your way through Lord Eradikus' spaceship to nab artifacts and an escape pod.,Clank! In! Space!: A Deck-Building Adventure,boardgame,2017
7.96,1658288330.651143,7.493,163068,8471.0,110,Magicians perform dazzling tricks for money and fame in a Victorian steampunk world.,Trickerion: Legends of Illusion,boardgame,2015
7.61,1658288330.651143,7.493,36218,83835.0,111,Acquire the most valuable lands by building your deck with treasure and power cards.,Dominion,boardgame,2008
7.58,1658288330.651143,7.49,178900,78378.0,112,Give your team clever one-word clues to help them spot their agents in the field.,Codenames,boardgame,2015
8.34,1658288330.651143,7.489,218417,4537.0,113,War Eternal is a standalone game compatible with the deck building game Aeon's End.,Aeon's End: War Eternal,boardgame,2017
7.63,1658288330.651143,7.487,132531,29208.0,114,"Utilize your dice populace to develop technologies, settle worlds, and ship goods.",Roll for the Galaxy,boardgame,2014
7.91,1658288330.651143,7.479,198928,9269.0,115,"Travel from Barcelona to Lisboa to cure malaria, typhus, yellow fever, and cholera.",Pandemic: Iberia,boardgame,2016
7.75,1658288330.651143,7.479,172287,15396.0,116,"Gain glory by defending a Viking harbor town against trolls, draugr and other beasts.",Champions of Midgard,boardgame,2015
7.69,1658288330.651143,7.477,263918,20322.0,117,The Queen's cartographers compete to sketch the most efficient maps.,Cartographers,boardgame,2019
7.83,1658288330.651143,7.476,196340,10325.0,118,Claim your fame as the dominant merchant in the Meiji period of Yokohama.,Yokohama,boardgame,2016
7.57,1658288330.651143,7.472,30549,113020.0,119,Your team of experts must prevent the world from succumbing to a viral pandemic.,Pandemic,boardgame,2008
7.76,1658288330.651143,7.47,266524,16170.0,120,"Hike through National Parks tiles, collecting memories and admiring gorgeous scenery.",PARKS,boardgame,2019
7.97,1658288330.651143,7.467,175155,8308.0,121,"Assemble your armies, devise your strategy, and wage war across the Herakon Cluster.",Forbidden Stars,boardgame,2015
7.73,1658288330.651143,7.466,262712,16340.0,122,"Rival mages create artifacts, vying for places of power and ancient monuments.",Res Arcana,boardgame,2019
8.15,1658288330.651143,7.465,175640,5408.0,123,The strategic craft of fine winemaking.,Vinhos Deluxe Edition,boardgame,2016
7.68,1658288330.651143,7.462,2511,19255.0,124,The game is afoot as you and your irregular friends search Victorian London for clues,Sherlock Holmes Consulting Detective: The Thames Murders & Other Cases,boardgame,1982
7.69,1658288330.651143,7.457,127023,17763.0,125,Play as warring Egyptian Gods and build the most powerful army to dominate Egypt.,Kemet,boardgame,2012
7.81,1658288330.651143,7.451,4098,9860.0,126,"Outperform your railroad rivals with shares, auctions, trackbuilding, and deliveries.",Age of Steam,boardgame,2002
8.1,1658288330.651143,7.445,279537,5497.0,127,"Plan, scan, and theorize to find a new planet at the edge of our solar system.",The Search for Planet X,boardgame,2020
7.64,1658288330.651143,7.44,118048,18798.0,128,A contest between two nomadic tribes along desert trade routes.,Targi,boardgame,2012
7.95,1658288330.651143,7.439,233398,7817.0,129,"Spread your glory over the vast, as of yet unexplored world in this updated classic.",Endeavor: Age of Sail,boardgame,2018
7.87,1658288330.651143,7.439,274364,8355.0,130,Hide or expose the greatest American political scandal in a tug of war for evidence.,Watergate,boardgame,2019
7.66,1658288330.651143,7.438,161970,20434.0,131,Showcase your alchemical know-how by publishing theories in this app-driven game.,Alchemists,boardgame,2014
7.7,1658288330.651143,7.437,43015,13364.0,132,Build networks of merchants along the roads and market towns of the Hanseatic League.,Hansa Teutonica,boardgame,2009
7.57,1658288330.651143,7.433,147020,40160.0,133,Compete head-to-head to create the most powerful deck of spaceships and bases.,Star Realms,boardgame,2014
7.77,1658288330.651143,7.432,146652,12356.0,134,"In space, no one can hear you build a deck of marine & weapon cards to fight aliens.",Legendary Encounters: An Alien Deck Building Game,boardgame,2014
7.78,1658288330.651143,7.431,271324,11909.0,135,"Draft yourself the ‘perfect’ dystopia, complete projects and churn out resources.",It's a Wonderful World,boardgame,2019
7.55,1658288330.651143,7.429,34635,48673.0,136,Travel to the time of hunters and gatherers in this classic game of tools and tribes.,Stone Age,boardgame,2008
7.66,1658288330.651143,7.428,103885,24092.0,137,Pilot your ships in tight arcs to take out the enemy! The universe can be yours.,Star Wars: X-Wing Miniatures Game,boardgame,2012
8.53,1658288330.651143,7.426,341169,3236.0,138,Wrangle your herd of cows across the Midwest prairie and deliver it to Kansas City.,Great Western Trail (Second Edition),boardgame,2021
8.32,1658288330.651143,7.423,231733,4299.0,139,"Renovate an estate, manage servants, and pursue romance in Victorian England.",Obsession,boardgame,2018
7.64,1658288330.651143,7.42,217372,17697.0,140,Race through a dense South American jungle in pursuit of the legendary city of gold.,The Quest for El Dorado,boardgame,2017
7.54,1658288330.651143,7.42,14996,66254.0,141,Build train routes across Europe in this sequel to the hit family board game.,Ticket to Ride: Europe,boardgame,2005
8.31,1658288330.651143,7.419,256916,3877.0,142,Traders compete to build the greatest empire in the Roman Mediterranean.,Concordia Venus,boardgame,2018
7.59,1658288330.651143,7.418,233867,24185.0,143,"Design the most appealing 1950s neighborhood, with fences, parks, and swimming pools.",Welcome To...,boardgame,2018
7.56,1658288330.651143,7.411,148949,28239.0,144,Send your assistants through the shops of Istanbul as you race to acquire rubies.,Istanbul,boardgame,2014
7.66,1658288330.651143,7.409,77423,22625.0,145,Guide your fellowship as it embarks on unique adventures in Tolkien's Middle-earth!,The Lord of the Rings: The Card Game,boardgame,2011
7.61,1658288330.651143,7.405,254640,18468.0,146,"Give one-word clues so someone can guess one word, but duplicate clues are discarded.",Just One,boardgame,2018
7.73,1658288330.651143,7.403,220877,11337.0,147,Manage your dice to build profitable markets and grand monuments in historic India.,Rajas of the Ganges,boardgame,2017
7.61,1658288330.651143,7.402,244522,19294.0,148,"Draft dice to mark numbers on your scoresheet, comboing bonuses to power your points.",That's Pretty Clever!,boardgame,2018
8.04,1658288330.651143,7.398,308765,5656.0,149,Wealthy citizens of medieval Prague organize building projects to gain king's favor.,Praga Caput Regni,boardgame,2020
7.88,1658288330.651143,7.398,82222,8667.0,150,Pilot your ship to stardom in a massive sci-fi sandbox.,Xia: Legends of a Drift System,boardgame,2014
7.73,1658288330.651143,7.397,287954,11622.0,151,You're an artisan working on creating striking patterns within a king's palace.,Azul: Summer Pavilion,boardgame,2019
7.65,1658288330.651143,7.396,104162,24097.0,152,Fight the Overlord and level up your heroes in this fantasy dungeon campaign.,Descent: Journeys in the Dark (Second Edition),boardgame,2012
7.67,1658288330.651143,7.396,43111,14899.0,153,Rival chaos gods send forth their minions to spread corruption and destruction.,Chaos in the Old World,boardgame,2009
8.05,1658288330.651143,7.395,283948,5428.0,154,"Travel to cities along the silk road, trading silk, spice, gold & jade along the way.",Marco Polo II: In the Service of the Khan,boardgame,2019
7.77,1658288330.651143,7.395,9609,10302.0,155,"Rings, Fellowship, diplomacy and war in the Third Age of Middle Earth.",War of the Ring,boardgame,2004
7.5,1658288330.651143,7.387,54043,43635.0,156,Trade and sell goods to become the most wealthy merchant in this short game for two.,Jaipur,boardgame,2009
7.97,1658288330.651143,7.381,265188,5951.0,157,"Expand your Scottish clan by trading livestock, making whisky and gaining landmarks.",Glen More II: Chronicles,boardgame,2019
7.55,1658288330.651143,7.381,463,35743.0,158,Cast spells and summon fantasy monsters in the original collectible card game.,Magic: The Gathering,boardgame,1993
