avg_rating,extracted_at,geek_rating,id,num_voters,rank,short_description,title,type,year_published
7.44,1658288330.651143,6.935,290236,5930.0,485,Artistically layer your paintings to create a masterpiece and win the Best in Show!,Canvas,boardgame,2021
7.04,1658288330.651143,6.935,11,41427.0,486,"Farm beans, harvest crops and trade your way to fortune in this card game classic.",Bohnanza,boardgame,1997
7.72,1658288330.651143,6.933,875,3235.0,487,Develop a logistical network from pack animals to the stock market.,Roads & Boats,boardgame,1999
7.56,1658288330.651143,6.932,142379,4372.0,488,"Escape the city, but don't forget to grab your loot on the way out!",Escape Plan,boardgame,2019
7.13,1658288330.651143,6.932,156009,15230.0,489,"Hire a crew and loot ships, but don't get too greedy or you sail away empty handed!",Port Royal,boardgame,2014
7.18,1658288330.651143,6.932,102652,15485.0,490,A diverse cast of superheroes work together to foil the plans of evil villains.,Sentinels of the Multiverse,boardgame,2011
7.67,1658288330.651143,6.931,258210,3589.0,491,Deploy units in different theaters of combat to win WW2.,Blitzkrieg!: World War Two in 20 Minutes,boardgame,2019
7.11,1658288330.651143,6.931,9674,16323.0,492,Place hexagonal tiles to score lines of colors.,Ingenious,boardgame,2004
7.67,1658288330.651143,6.931,31999,3508.0,493,Capture all of an opponent's type of pieces or make them unable to capture yours.,TZAAR,boardgame,2007
7.1,1658288330.651143,6.93,147949,24275.0,494,An app-driven Werewolf that lasts but a single night. Wolves and villagers beware!,One Night Ultimate Werewolf,boardgame,2014
7.3,1658288330.651143,6.927,90419,7123.0,495,Expand airlines across Europe to make your investments pay off.,Airlines Europe,boardgame,2011
7.21,1658288330.651143,6.924,163968,9134.0,496,"Create mighty combinations, write epic legends, and earn the favour of the Gods.",Elysium,boardgame,2015
7.4,1658288330.651143,6.923,58421,5300.0,497,Struggle against the Nile's current to construct Egypt's iconic monuments.,Egizia,boardgame,2009
7.03,1658288330.651143,6.92,133473,40225.0,498,"Pass the sushi around, but keep the best for yourself. Save room for dessert!",Sushi Go!,boardgame,2013
7.07,1658288330.651143,6.919,18,23187.0,499,Use pre-programmed movement cards to race your robot around a hazardous factory.,RoboRally,boardgame,1994
7.74,1658288330.651143,6.919,256952,3475.0,500,Save the school from a cartoonish zombie horde. Unlock fun new content as you play!,Zombie Kidz Evolution,boardgame,2018
7.21,1658288330.651143,6.919,232043,9577.0,501,"Build a tile queendom independently, or mix with Kingdomino for more players and fun.",Queendomino,boardgame,2017
7.25,1658288330.651143,6.918,31730,7854.0,502,Build track and buy stock to get the most money in this railroad race to Chicago.,Chicago Express,boardgame,2007
7.25,1658288330.651143,6.917,27173,8181.0,503,Different-colored Vikings have different responsibilities. Which do you need most?,Vikings,boardgame,2007
8.53,1658288330.651143,6.916,299659,1716.0,504,Advance your ancient civilization from tiny settlement to mighty empire.,Clash of Cultures: Monumental Edition,boardgame,2021
7.03,1658288330.651143,6.916,6249,31086.0,505,Compete to build the most valuable picturesque walled city in 13th-century Granada.,Alhambra,boardgame,2003
7.18,1658288330.651143,6.914,34119,12191.0,506,Experience intriguing Arabian legends while competing to find your story and destiny.,Tales of the Arabian Nights,boardgame,2009
7.48,1658288330.651143,6.913,42052,4664.0,507,"Build a prestigious winery with sales, exports, tastings & helpful influencers.",Vinhos,boardgame,2010
7.47,1658288330.651143,6.912,181530,5551.0,508,Adventure across Terrinoth acquiring skills and items to defeat the great villain.,Runebound (Third Edition),boardgame,2015
7.18,1658288330.651143,6.911,97842,9685.0,509,Spend all your money the fastest to inherit loads more in this rich card game.,Last Will,boardgame,2011
7.19,1658288330.651143,6.91,183251,9884.0,510,"Forge a path through the jungle, pick up gems along the way and reach the temples.",Karuba,boardgame,2015
7.68,1658288330.651143,6.909,128780,3371.0,511,¡Mexico bien vale una traición!,Pax Porfiriana,boardgame,2012
7.27,1658288330.651143,6.909,475,7400.0,512,Appeal to members of the Indian court in order to build your palaces and claim goods.,Taj Mahal,boardgame,2000
7.53,1658288330.651143,6.908,151022,4155.0,513,"Build a championship baseball team filled with Naturals, Cyborgs, and Robots.",Baseball Highlights: 2045,boardgame,2015
7.24,1658288330.651143,6.908,91312,9855.0,514,Control the comic fantasy city peopled by iconic characters menaced by wizard magic.,Discworld: Ankh-Morpork,boardgame,2011
7.19,1658288330.651143,6.907,133038,12412.0,515,Level up your party in this card-and-dice fantasy campaign set in the land of Varisa.,Pathfinder Adventure Card Game: Rise of the Runelords – Base Set,boardgame,2013
8.2,1658288330.651143,6.907,175095,2117.0,516,Defend Farmingdale against the zombie horde.,Dawn of the Zeds (Third Edition),boardgame,2016
8.16,1658288330.651143,6.906,252328,2382.0,517,"Form a squadron, plan its moves, take actions and engage the enemy in a dog fight.",Star Wars: X-Wing (Second Edition),boardgame,2018
7.59,1658288330.651143,6.905,192836,3864.0,518,"Build up your village in this epic, generation-spanning resource-management game.",The Colonists,boardgame,2016
7.45,1658288330.651143,6.905,196326,5081.0,519,Navigate the intrigue and politics of the court to earn favour with the princess.,Love Letter Premium,boardgame,2016
7.34,1658288330.651143,6.905,22827,7273.0,520,Place secret orders to outmaneuver your opponents and gain control of key locations.,StarCraft: The Board Game,boardgame,2007
7.21,1658288330.651143,6.904,27746,8715.0,521,As a Roman Impresario you must stage the greatest spectacles the Colosseum has seen!,Colosseum,boardgame,2007
7.7,1658288330.651143,6.903,84419,3473.0,522,Venture in the vast space with your fleet to make your empire prevail in the galaxy.,Space Empires 4X,boardgame,2011
7.07,1658288330.651143,6.901,218603,20181.0,523,"Trees compete for sunlight to grow taller, as the sun moves around the board.",Photosynthesis,boardgame,2017
7.04,1658288330.651143,6.901,153938,24772.0,524,Which camel will win? Place your bets in this zany family friendly camel racing game.,Camel Up,boardgame,2014
7.56,1658288330.651143,6.9,260180,4123.0,525,"Players collect pieces, pick cards and fill in various shapes to get the most points!",Project L,boardgame,2020
7.21,1658288330.651143,6.899,15363,8671.0,526,Corporations battle it out to dominate each other and the alien species that await!,Nexus Ops,boardgame,2005
7.16,1658288330.651143,6.899,141572,9943.0,527,Use letter cards to build words that let you buy more powerful letters and score.,Paperback,boardgame,2014
7.45,1658288330.651143,6.893,2346,4725.0,528,Avoid being disconnected from the three DVONN pieces on an ever-shrinking board.,DVONN,boardgame,2001
7.55,1658288330.651143,6.893,3685,4002.0,529,William Wallace clashes with England to determine the fate of 13th-century Scotland.,Hammer of the Scots,boardgame,2002
7.27,1658288330.651143,6.891,159508,6967.0,530,Coordinate programmer and scientist to gather data from the depths of the Ocean.,AquaSphere,boardgame,2014
7.06,1658288330.651143,6.889,28023,17900.0,531,Race around Jamaica to claim its spoils.  Beware! The fastest doesn't always win!,Jamaica,boardgame,2007
7.77,1658288330.651143,6.889,284742,3058.0,532,Bees have discovered economics! Make and sell honey to get money and win!,Honey Buzz,boardgame,2020
8.5,1658288330.651143,6.888,256680,1884.0,533,Cooperative or competitive strategy game pitting heroes against an ominous Tower.,Return to Dark Tower,boardgame,2022
7.45,1658288330.651143,6.888,170561,4903.0,534,"Use magic, money, and might to recruit citizens, defeat monsters, and conquer lands.",Valeria: Card Kingdoms,boardgame,2016
7.51,1658288330.651143,6.887,247367,4152.0,535,Submit orders on three fronts to outwit and outmatch your military opponent.,"Air, Land, & Sea",boardgame,2019
7.39,1658288330.651143,6.885,284435,5356.0,536,"Draft tiles to complete adjacency combos in this beautiful, abstract tableau builder.",Nova Luna,boardgame,2019
7.1,1658288330.651143,6.883,155703,15116.0,537,Adapt in an ever-changing ecosystem where food is scarce and predators lurk.,Evolution,boardgame,2014
7.77,1658288330.651143,6.883,183562,3009.0,538,,Star Wars: X-Wing Miniatures Game – The Force Awakens Core Set,boardgame,2015
7.33,1658288330.651143,6.882,39351,5570.0,539,"Relive automotive history through research, production, and sale of classic cars.",Automobile,boardgame,2009
7.08,1658288330.651143,6.882,503,13312.0,540,Pretty pastel camels belie the intensity of this tight area-control classic.,Through the Desert,boardgame,1998
7.68,1658288330.651143,6.882,160010,4302.0,541,Become the Overlord or play as Conan and his companions in this action-packed game!,Conan,boardgame,2016
7.18,1658288330.651143,6.882,172308,9131.0,542,Collect ingredients and deliver valuable potions by outguessing your opponents.,Broom Service,boardgame,2015
7.52,1658288330.651143,6.88,9625,4028.0,543,"Form alliances, explore the new world, and conquer your enemies to create an empire.",Struggle of Empires,boardgame,2004
7.14,1658288330.651143,6.88,117959,10202.0,544,Win the payout from various casinos by placing the most dice on them.,Las Vegas,boardgame,2012
7.52,1658288330.651143,6.88,216600,4062.0,545,Build factories! Train your workers! Manufacture as many goods as possible!,Fantastic Factories,boardgame,2019
7.12,1658288330.651143,6.879,220,10986.0,546,"Show off by splurging on expensive indulgences, but avoid overspending and scandal.",High Society,boardgame,1995
7.24,1658288330.651143,6.879,39938,6945.0,547,"Buy land, build buildings & roads, protect your income and buy some points.",Carson City,boardgame,2009
7.13,1658288330.651143,6.879,4390,12077.0,548,"Hunt, fish, and gather in this Stone Age version of the tile-laying classic.",Carcassonne: Hunters and Gatherers,boardgame,2002
7.11,1658288330.651143,6.878,42215,11405.0,549,Determine the location of a hidden treasure and race your opponents to it.,Tobago,boardgame,2009
7.4,1658288330.651143,6.876,140603,4862.0,550,"Privateers wrangle to fit out in port, then set sail for adventure in the Caribbean.",Francis Drake,boardgame,2013
7.19,1658288330.651143,6.874,6472,10360.0,551,Make alliances—and break them!—as you strive to both unite and conquer Westeros.,A Game of Thrones,boardgame,2003
8.01,1658288330.651143,6.871,212445,2496.0,552,Humans take on the Orcs in this tabletop reimagination of football.,Blood Bowl (2016 Edition),boardgame,2016
7.48,1658288330.651143,6.87,205359,5030.0,553,"Duel with teams of heroes and villains from the galaxy far, far away.",Star Wars: Destiny,boardgame,2016
7.53,1658288330.651143,6.869,169255,4567.0,554,Command Westeros' factions and plot your path to the Iron Throne.,A Game of Thrones: The Card Game (Second Edition),boardgame,2015
7.28,1658288330.651143,6.869,270673,6097.0,555,"Flip cards, complete islands and score points in this Flip 'n' Write.",Silver & Gold,boardgame,2019
7.58,1658288330.651143,6.869,216734,4781.0,556,Roll dice to trigger skills and defeat your opponents.,Dice Throne: Season One,boardgame,2018
7.46,1658288330.651143,6.869,42776,4887.0,557,"Be a COG soldier, fighting the Locust against all odds in a final desperate stand.",Gears of War: The Board Game,boardgame,2011
7.7,1658288330.651143,6.868,248490,3085.0,558,Atlantis is sinking. Can you work together to build your escape before it's lost?,Atlantis Rising (Second Edition),boardgame,2019
7.71,1658288330.651143,6.868,265402,3270.0,559,"Lead a band of trolls to excavate their mountain home, erecting statues for glory.",In the Hall of the Mountain King,boardgame,2019
7.13,1658288330.651143,6.865,113924,17721.0,560,Work together to kill zombies! Improve skills! Then kill more zombies!,Zombicide,boardgame,2012
7.18,1658288330.651143,6.864,257501,10543.0,561,Your deck is unique. Race to three keys to be the first to unlock the great Vaults!,KeyForge: Call of the Archons,boardgame,2018
6.99,1658288330.651143,6.862,131357,40588.0,562,Bluff (and call bluffs!) to victory in this card game with no third chances.,Coup,boardgame,2012
7.26,1658288330.651143,6.861,143519,7039.0,563,Puzzle your way to victory through clever positioning to dominate the galaxy.,Quantum,boardgame,2013
7.73,1658288330.651143,6.86,245961,2817.0,564,Deploy your fleet of fishing boats while developing your bustling harbor.,Fleet: The Dice Game,boardgame,2018
8.16,1658288330.651143,6.858,130960,2020.0,565,"European struggle between communist, fascist, and capitalist systems during 1936-1945",Triumph & Tragedy: European Balance of Power 1936-1945,boardgame,2015
7.55,1658288330.651143,6.856,174785,3807.0,566,Lead your ancient empire to the dominion of the Mediterranean Sea.,Mare Nostrum: Empires,boardgame,2016
7.13,1658288330.651143,6.856,30869,9492.0,567,"Become an archaeologist as you study ancient cultures, go digging, and exhibit.",Thebes,boardgame,2007
7.59,1658288330.651143,6.855,303057,3552.0,568,Triumph in the golden age of air travel.,Pan Am,boardgame,2020
7.15,1658288330.651143,6.855,264055,9348.0,569,A dinosaur park will always attract tourists – if you can place your species right.,Draftosaurus,boardgame,2019
7.65,1658288330.651143,6.853,269511,3150.0,570,Develop your peninsula and sail as far as you can around the island.,Cooper Island,boardgame,2019
7.88,1658288330.651143,6.851,135219,2546.0,571,"The Climactic Battle of the Hobbit, by the team that brought you War of the Ring!",The Battle of Five Armies,boardgame,2014
7.35,1658288330.651143,6.847,119432,4795.0,572,Brave the elements as you drive your railroad through the peak of Mount Snowdon.,Snowdonia,boardgame,2012
7.81,1658288330.651143,6.845,193949,2999.0,573,"Romulans, Klingons, and Federation compete for galactic supremacy.",Star Trek: Ascendancy,boardgame,2016
7.54,1658288330.651143,6.845,1513,4044.0,574,Politicians cooperate and compete over personal and Ancient Roman glory.,The Republic of Rome,boardgame,1990
7.01,1658288330.651143,6.841,37904,18303.0,575,Use custom dice to race in the cities and on Formula 1 courses.,Formula D,boardgame,2008
7.34,1658288330.651143,6.84,163166,5411.0,576,No ordinary game of Werewolf as now everyone has special roles. Werewolves beware!,One Night Ultimate Werewolf: Daybreak,boardgame,2015
8.02,1658288330.651143,6.84,198953,2152.0,577,Shrewd Renaissance bankers sway 15-16th Century European powers for personal gains.,Pax Renaissance,boardgame,2016
7.64,1658288330.651143,6.84,73171,3314.0,578,"500 years after global war, two factions vie to control this strange new world.",Earth Reborn,boardgame,2010
7.05,1658288330.651143,6.839,10547,41450.0,579,Explore a haunted house as a team ... until one of you turns against the rest.,Betrayal at House on the Hill,boardgame,2004
7.29,1658288330.651143,6.838,1353,5432.0,580,Get your teammates to guess real & fictional people while clues become more limited.,Time's Up!,boardgame,1999
7.0,1658288330.651143,6.838,209778,18343.0,581,Silently cooperate to rob a labyrinthine shopping mall before time runs out.,Magic Maze,boardgame,2017
7.15,1658288330.651143,6.838,121408,8055.0,582,Buy the right mix of cards to build track to and lay stations in the biggest cities.,Trains,boardgame,2012
7.74,1658288330.651143,6.837,224710,3566.0,583,"Fight infected orcs and goblins amidst hedges, flooded streets and heavy artillery.",Zombicide: Green Horde,boardgame,2018
7.15,1658288330.651143,6.835,24508,8231.0,584,Race to build temples and towers or tribal supremacy on an active volcanic island.,Taluva,boardgame,2006
7.16,1658288330.651143,6.832,46,7631.0,585,"A tense, simple auction game which shines with five or six players",Medici,boardgame,1995
6.98,1658288330.651143,6.831,5782,19387.0,586,"Collect colorful chameleons, but be careful! Don't take too many types.",Coloretto,boardgame,2003
7.24,1658288330.651143,6.83,58281,6401.0,587,Summon units of your faction to fight and bring down the opposing Summoner.,Summoner Wars,boardgame,2009
7.69,1658288330.651143,6.83,111799,2853.0,588,Play as one of four factions vying for control of Cuba in card-driven COIN Vol:2.,Cuba Libre,boardgame,2013
7.43,1658288330.651143,6.828,180511,4108.0,589,"Dazzle the London crowds as you write, cast and stage your play in one glorious week.",Shakespeare,boardgame,2015
7.43,1658288330.651143,6.827,283393,3990.0,590,Recruit heroes and conquer locations in a race to expand your kingdom under the sea.,Aquatica,boardgame,2019
7.0,1658288330.651143,6.824,21763,16643.0,591,The investigator tries to eliminate suspects while Jack tries to escape and hide.,Mr. Jack,boardgame,2006
7.68,1658288330.651143,6.824,266121,2788.0,592,"Sherlock, Insert Coin, and Pursuit of White Rabbit.",Unlock!: Heroic Adventures,boardgame,2018
7.14,1658288330.651143,6.824,13004,7888.0,593,Trouble strikes at the foot of Vesuvius. Creeping lava! Who will survive unscathed?,The Downfall of Pompeii,boardgame,2004
8.33,1658288330.651143,6.823,206480,1799.0,594,"France and Britain clash globally over trade, influence and territory in the 1700s.",Imperial Struggle,boardgame,2020
7.22,1658288330.651143,6.823,50750,6176.0,595,"Compete with other architects to build the city using dwarves, elves and gnomes.",Belfort,boardgame,2011
7.2,1658288330.651143,6.823,3201,6730.0,596,Hide your force and your intentions from the opponent as light faces off against dark,Lord of the Rings: The Confrontation,boardgame,2002
8.07,1658288330.651143,6.822,239942,2422.0,597,Cast spells and combat other mages to become ruler of a mysterious lodge.,Black Rose Wars,boardgame,2019
7.4,1658288330.651143,6.818,121288,4410.0,598,"Give a perfect clue to cause some, but not all, to guess your dreamlike card.",Dixit: Journey,boardgame,2012
8.04,1658288330.651143,6.817,150997,2314.0,599,Co-op dungeon crawl the monster-ridden Old West mines and hot Jargono otherworld.,Shadows of Brimstone: Swamps of Death,boardgame,2014
6.95,1658288330.651143,6.816,107529,21579.0,600,Use special placement rules and variable scoring goals to build the best kingdom.,Kingdom Builder,boardgame,2011
7.23,1658288330.651143,6.816,296912,6302.0,601,Build the most awesome fort while making friends and eating pizza.,Fort,boardgame,2020
7.16,1658288330.651143,6.813,699,12070.0,602,Explore dungeons and complete quests in this RPG-inspired fantasy adventure.,HeroQuest,boardgame,1989
6.94,1658288330.651143,6.813,432,24610.0,603,"Choose sequential cards for rows simultaneously, but avoid adding the 6th card!",6 nimmt!,boardgame,1994
7.13,1658288330.651143,6.813,30380,8109.0,604,"In pre-revolution Cuba, produce and ship goods, and influence the Parliament to help.",Cuba,boardgame,2007
7.3,1658288330.651143,6.812,70512,4815.0,605,Impress the Moon Priestess by sending novices to Holy Isles surrounding the Temple.,Luna,boardgame,2010
7.09,1658288330.651143,6.812,171499,9647.0,606,Cultivate and trade the 'fruit of the gods' and lead your tribe to prosperity.,Cacao,boardgame,2015
7.2,1658288330.651143,6.812,203416,6037.0,607,Work out hieroglyphs and clues before this ancient pyramid becomes your tomb.,Exit: The Game – The Pharaoh's Tomb,boardgame,2016
7.1,1658288330.651143,6.81,88,9209.0,608,Build towers and populate them with your knights to make it big in the Middle Ages.,Torres,boardgame,1999
7.23,1658288330.651143,6.809,134726,6772.0,609,"Now you can fight with killer plants, ghosts, steampunk, and bear cavalry!",Smash Up: Awesome Level 9000,boardgame,2013
6.97,1658288330.651143,6.808,100423,23755.0,610,Roll dice to investigate the horrors of Arkham alone or as a group.,Elder Sign,boardgame,2011
6.98,1658288330.651143,6.807,113294,16246.0,611,Run as fast as you can to return the cursed gems before the temple traps you forever.,Escape: The Curse of the Temple,boardgame,2012
7.35,1658288330.651143,6.807,116998,4681.0,612,Defeat an ancient evil protecting and feeding on a thunderstone.,Thunderstone Advance: Towers of Ruin,boardgame,2012
7.27,1658288330.651143,6.807,126792,5325.0,613,Your colony of ants lay pheromones to control the land while building your anthill!,Myrmes,boardgame,2012
7.77,1658288330.651143,6.805,343905,2452.0,614,Create a new life for yourself in Boonlake.,Boonlake,boardgame,2021
7.52,1658288330.651143,6.803,170624,3308.0,615,"Convert the locals, build churches & banks and spread the influence of your order.",Crusaders: Thy Will Be Done,boardgame,2018
7.11,1658288330.651143,6.802,20963,9134.0,616,"The vampire hunters chase Dracula through Europe, while evading his deadly traps.",Fury of Dracula (Second Edition),boardgame,2005
7.65,1658288330.651143,6.802,163839,3264.0,617,"Control guilds, spread influence and feud with other nobles in this medieval sandbox.",Feudum,boardgame,2017
7.28,1658288330.651143,6.802,258036,5198.0,618,Help your 2 neighboring players build the wackiest—but highest scoring—castles.,Between Two Castles of Mad King Ludwig,boardgame,2018
7.21,1658288330.651143,6.8,155624,6071.0,619,Hide or hunt in this tactical game of cat and mouse!,Specter Ops,boardgame,2015
7.57,1658288330.651143,6.8,160495,3055.0,620,Carefully manage civil unrest while rebuilding China for the Emperor.,ZhanGuo,boardgame,2014
7.21,1658288330.651143,6.799,213893,6078.0,621,"Sail through this beautiful archipelago, build vast palaces, and hire specialists.",Yamataï,boardgame,2017
8.14,1658288330.651143,6.799,339789,1798.0,622,Escape from Earth and plan the humankind journey to the moon to save humanity.,Welcome to the Moon,boardgame,2021
6.96,1658288330.651143,6.798,123540,23165.0,623,"Travel the famed Tokaido road, visit hot springs, try new food, and paint landscapes.",Tokaido,boardgame,2012
7.57,1658288330.651143,6.798,190082,3129.0,624,Work together to chase a hidden killer through the foggy streets of Victorian London.,Whitehall Mystery,boardgame,2017
7.76,1658288330.651143,6.798,173064,2649.0,625,Space agencies launch realistic rockets to explore space and nearby planets.,Leaving Earth,boardgame,2015
7.84,1658288330.651143,6.797,154825,2242.0,626,Amass wealth as a manufacturing entrepreneur — embrace the industrial revolution.,Arkwright,boardgame,2014
8.29,1658288330.651143,6.797,29603,1714.0,627,Command the US landing forces that storm Omaha Beach on D-Day.,D-Day at Omaha Beach,boardgame,2009
7.28,1658288330.651143,6.797,65532,5343.0,628,Fantasy heroes join forces and cards to defeat the ever advancing enemy hordes.,Defenders of the Realm,boardgame,2010
8.31,1658288330.651143,6.795,332800,1699.0,629,The fight for Itharia is on! Defeat the enemy summoner before they cut yours down.,Summoner Wars (Second Edition),boardgame,2021
8.0,1658288330.651143,6.795,322708,2733.0,630,An app-driven dungeon crawl set in the world of Terrinoth.,Descent: Legends of the Dark,boardgame,2021
7.75,1658288330.651143,6.792,153016,2514.0,631,Let the hilarity begin as you try your best to draw and interpret sketches.,Telestrations: 12 Player Party Pack,boardgame,2011
7.29,1658288330.651143,6.79,193558,4679.0,632,Navigate the Aegean as you race to complete 12 quests to impress Zeus.,The Oracle of Delphi,boardgame,2016
7.19,1658288330.651143,6.79,162007,6328.0,633,Race in wacky contraptions as a variety of history’s greatest inventors.,Steampunk Rally,boardgame,2015
7.62,1658288330.651143,6.79,271518,3372.0,634,"Evil has never looked so wicked with poison, voodoo, and titans galore.",Disney Villainous: Wicked to the Core,boardgame,2019
7.37,1658288330.651143,6.789,87890,4188.0,635,An economic strategy game set in the world of fashion.,Prêt-à-Porter,boardgame,2010
7.33,1658288330.651143,6.789,181521,5202.0,636,"Roll dice, pick skills, & smash vermin in a grim & dark narrative adventure.",Warhammer Quest: The Adventure Card Game,boardgame,2015
7.24,1658288330.651143,6.789,2955,5443.0,637,Build the old Aztec city of Tenochtitlan with flowing canals and beautiful temples.,Mexica,boardgame,2002
7.52,1658288330.651143,6.789,244115,3477.0,638,Grow your Mastery and expand your armies. Unlock the potential hidden in your cards.,Shards of Infinity,boardgame,2018
7.27,1658288330.651143,6.788,168584,5339.0,639,"Deduce your way to survival; either as the dark knight, or as a Gotham villain.",Love Letter: Batman,boardgame,2015
7.29,1658288330.651143,6.788,233247,5526.0,640,"Build Wonders, expand across the map and develop your Empire.",Civilization: A New Dawn,boardgame,2017
7.17,1658288330.651143,6.787,146278,6646.0,641,Place units in 2D shapes to summon powerful beings and claim a rotating set of goals.,Tash-Kalar: Arena of Legends,boardgame,2013
7.47,1658288330.651143,6.787,3307,3558.0,642,"Plan your strategy to control central Europe, but don't forget to feed your armies!",Wallenstein,boardgame,2002
7.91,1658288330.651143,6.787,290359,2251.0,643,Lead a team of desert commandos in a WWII multi-scenario deck builder with vehicles.,Undaunted: North Africa,boardgame,2020
7.82,1658288330.651143,6.785,165401,2263.0,644,A tug-of-war struggle for the future of a divided Germany.,Wir sind das Volk!,boardgame,2014
8.01,1658288330.651143,6.785,323612,2064.0,645,Become the next great spirit of the forest exploring it and helping lost souls.,Bitoku,boardgame,2021
7.03,1658288330.651143,6.785,69789,12611.0,646,Forge your deck with mighty heroes and constructs to claim the most honor.,Ascension: Deckbuilding Game,boardgame,2010
7.16,1658288330.651143,6.784,15364,6216.0,647,Bid on tiles to build the best casino in all of Las Vegas.,Vegas Showdown,boardgame,2005
